feature_id,feature_name_ru,value_type,value_id,value_ru,comment_ru,comment_en,page_numbers
A-1,Количество степеней подъема гласных,listed,A-1-2,Три,,,
A-2,Подъемы гласных,listed,A-2-3,"Верхний, средний и нижний",,,
A-210,Противопоставление по открытости/закрытости в подъемах гласных,not_stated,,,,,
A-3,Ряды гласных,not_stated,,,,,
A-4,Фонологические ступени долготы,not_stated,,,,,
A-5,Противопоставление гласных по лабиализации,listed,A-5-1,Противопоставление гласных по лабиализации отсутствует,,,
A-6,Противопоставление гласных по назализации,listed,A-6-1,Противопоставление гласных по назализации отсутствует,,,
A-7,Противопоставление гласных по фарингализации,listed,A-7-1,Противопоставление гласных по фарингализации отсутствует,,,
A-8,Противопоставление гласных по продвинутости корня языка,listed,A-8-1,Противопоставление гласных по продвинутости корня языка отсутствует,,,
A-9,Наличие дифтонгов и трифтонгов,listed,A-9-1,Дифтонги и трифтонги отсутствуют,,,
A-10,Типы дифтонгов,not_applicable,,,,,
A-11,Инвентарь шумных согласных по ларингальным признакам,listed,A-11-20,Абруптивные и преруптивные согласные,,,
A-12,Инвентарь шумных согласных по способу артикуляции,listed,A-12-3,"Взрывные, фрикативные и аффрикаты",,,
A-13,Инвентарь шумных согласных по месту образования,listed,A-13-3,"Лабиальные, переднеязычные, среднеязычные и заднеязычные",,,
A-14,Инвентарь шумных губных согласных по месту образования,not_stated,,,,,
A-15,Шумные переднеязычные согласные по месту образования,not_stated,,,,,
A-16,Шумные заднеязычные согласные по месту образования,not_stated,,,,,
A-17,Шумные постувулярные согласные по месту образования,not_stated,,,,,
A-18,Дополнительные артикуляционные противопоставления шумных согласных,not_stated,,,,,
A-19,Инвентарь сонорных согласных по способу артикуляции,not_stated,,,,,
A-20,Инвентарь сонорных согласных по месту образования,not_stated,,,,,
A-21,Дополнительные противопоставления сонорных согласных,listed,A-21-4,По лабиализации,,,
A-220,Инвентарь фрикативных согласных по месту образования,not_stated,,,,,
B-1,Тип ударения,not_stated,,,,,
B-2,Вид ударения,not_stated,,,,,
B-3,Носитель ударения,not_stated,,,,,
B-4,Фиксированность ударения,not_stated,,,,,
B-5,Носитель фиксированного ударения в слове,not_stated,,,,,
B-6,Количество уровней тонов,not_stated,,,,,
B-7,Контурные признаки тона,not_stated,,,,,
B-8,Носитель тона,not_stated,,,,,
B-9,Характер долготы,not_stated,,,,,
B-10,Область гармонического уподобления гласных,not_stated,,,,,
B-11,Признак гармонического уподобления гласных,not_stated,,,,,
B-12,Уподобляющий элемент при гармоническом уподоблении гласных,not_stated,,,,,
B-13,Прочие супрасегментные явления,not_stated,,,,,
B-14,Типы фонации,not_stated,,,,,
C-1,Начальный согласный в слоге,listed,C-1-3,Большинство слогов прикрытые,,,
C-2,Конечный согласный в слоге,listed,C-2-5,Есть закрытые и открытые слоги,,,
D-1,Ограничения на фонемную структуру сегментных морфем в начальной позиции,listed,D-1-3,Только согласные,,,
D-2,Ограничения на фонемную структуру сегментных морфем в конечной позиции,listed,D-2-1,Отсутствуют,,,
D-3,Особенности слогового состава слова,not_stated,,,,,
D-4,Различия между знаменательными и служебными словами,not_stated,,,,,
D-5,Различия между исконными и заимствованными словами,not_stated,,,,,
D-6,Различия между корневыми и аффиксальными морфемами,not_stated,,,,,
D-7,Функциональный тип чередований,not_stated,,,,,
D-8,Вид чередований,not_stated,,,,,
E-1,Тип языка по способу соединения морфем в слове,listed,E-1-2,Агглютинативный с элементами флективного,,,
E-2,Признаки флективного строя,not_stated,,,,,
E-3,Признаки агглютинативного строя,not_stated,,,,,
E-4,Тип языка по степени спаянности морфем,listed,E-4-5,Синтетический,,,
F-1,Количество согласовательных классов,listed,F-1-1,Согласовательные классы отсутствуют,,,
F-2,Морфологические способы выражения согласовательных классов,not_applicable,,,,,
F-3,Синтаксические способы выражения согласовательных классов,not_applicable,,,,,
F-4,Другие способы выражения согласовательных классов,not_applicable,,,,,
F-5,Атрибутивное согласование по роду,not_stated,,,,,
F-6,Согласование количественных числительных в роде,not_stated,,,,,
F-7,Классифицирующие категории существительных,listed,F-7-1,Отсутствуют,,,
F-8,Противопоставление по личности/неличности,not_stated,,,,,
F-9,Способ выражения одушевленности/неодушевленности,not_stated,,,,,
G-1,Категория числа у существительных,listed,G-1-1,Единственное и множественное,,,
G-2,Маркирование единственного числа существительных,listed,G-2-2,Немаркированное,,,
G-3,Формы вежливости в местоимениях и глаголах,not_stated,,,,,
G-4,Согласование по числу,not_stated,,,,,
G-5,Форма числа существительного в сочетании с числительными,not_stated,,,,,
G-6,Система счисления,not_stated,,,,,
G-7,"Неопределенный артикль и числительное «один»",not_applicable,,,,,
H-1,Количество падежей у имени существительного,listed,H-1-2,Три-семь,,,
H-2,Маркирование субъекта и объекта,not_stated,,,,,
H-3,Падежное оформление именного сказуемого,not_stated,,,,,
H-4,Падежное оформление посессивного отношения в именной группе,custom,,отсутствует,,,
H-5,Другие способы оформления посессивного отношения,listed,H-5-3,Посессивные аффиксы,,,
H-6,Способ выражения пространственных отношений,not_stated,,,,,
H-7,Локус маркирования в посессивной конструкции,not_stated,,,,,
H-8,Падежное оформление одушевленных и неодушевленных имен существительных,not_stated,,,,,
H-9,Наличие вторичных падежей,not_stated,,,,,
I-1,Способ выражения залоговых форм в глаголе,not_stated,,,,,
I-2,Возможность наложения нескольких залоговых форм,not_stated,,,,,
I-3,Двойные залоговые формы,not_stated,,,,,
I-4,Совпадение залоговых форм,not_stated,,,,,
I-5,Основные временные противопоставления,listed,I-5-6,"Настоящее, прошедшее и будущее",,,
I-6,Выражение вида и времени,not_stated,,,,,
I-7,Способ выражения временных категорий,listed,I-7-1,Аффиксы,,,
I-8,Синкретическое выражение нескольких глагольных значений,listed,I-8-4,Лицо и число,,,
I-9,Маркирование лица в глаголе в настоящем времени,not_stated,,,,,
I-10,Маркер переходности,listed,I-10-4,Значимое морфологическое чередование,,,
J-1,Наличие местоименных слов,not_stated,,,,,
J-2,Способы выражения дейктических категорий,not_stated,,,,,
J-3,"Служебные части речи, выражающие пространственную ориентацию действия",listed,J-3-11,Превербы и послелоги,,,
J-4,"Знаменательные части речи, выражающие пространственную ориентацию действия",not_stated,,,,,
J-5,Морфологическое выражение определенности/неопределенности имени,not_stated,,,,,
J-6,"Части речи, выражающие определенность/неопределенность имени",not_stated,,,,,
J-7,Способы выражения форм вежливости,not_stated,,,,,
J-8,Способы выражения отрицания,listed,J-8-1,Отрицательные аффиксы,,,
J-9,Позиция показателя отрицания,listed,J-9-9,Препозиция или постпозиция,,,
K-1,Склонение личных местоимений,not_stated,,,,,
K-2,Типы артиклей,listed,K-2-1,Артикли отсутствуют,,,
K-3,Расположение артикля,not_applicable,,,,,
K-4,Постановка артикля в именной группе,not_applicable,,,,,
K-5,"Грамматические категории, выражаемые артиклем",not_applicable,,,,,
K-6,Количество типов спряжения глаголов,listed,K-6-1,Единый тип спряжения,,,
K-7,Типы глагольного согласования,listed,K-7-4,Субъектное и субъектно-объектное,,,
K-8,"Согласовательные категории, выражаемые причастием",not_stated,,,,,
K-9,"Время, выражаемое причастием",not_stated,,,,,
K-10,"Грамматические категории, выражаемые наречием",not_stated,,,,,
K-11,"Согласовательные категории, выражаемые прилагательным",not_stated,,,,,
K-12,Возможность кумулятивного выражения нескольких категорий в прилагательном,not_stated,,,,,
K-13,Атрибутивное согласование прилагательных,not_stated,,,,,
K-14,Типы атрибутивного согласования,not_stated,,,,,
K-15,"Изменяемые грамматические категории, выражаемые существительным",not_stated,,,,,
K-16,Кумулятивное выражение нескольких категорий в существительном,not_stated,,,,,
K-17,Средства словоизменения,not_stated,,,,,
K-18,Модель словоформы,listed,K-18-1,Префиксально-суффиксальная,,,
L-1,Способы словообразования,listed,L-1-12,Аффиксация и словосложение,,,
L-2,"Аффиксы, участвующие в словообразовании",not_stated,,,,,
L-3,Отношения между соединяемыми основами при сложении основ,not_stated,,,,,
M-1,Стратегия кодирования глагольных актантов,listed,M-1-5,Эргативная,,,
M-2,Фиксированность порядка слов,not_stated,,,,,
M-3,Основной порядок слов в предложении,listed,M-3-1,SVO,,,
M-4,Порядок определения и определяемого,listed,M-4-2,Определение следует за определяемым,,,
M-5,Опущение местоименного подлежащего в неэллиптических предложениях,not_stated,,,,,
N-1,Линейный порядок компонентов в сложном предложении,not_stated,,,,,
N-2,Особенности подчиненного компонента в сложном предложении,not_stated,,,,,
N-3,Оформление сказуемого в придаточном предложении,not_stated,,,,,
N-4,Тип построения сложного предложения,not_stated,,,,,
N-5,Тип связи между элементами сложного предложения,not_stated,,,,,
