feature_id,feature_name_ru,value_type,value_id,value_ru,comment_ru,comment_en,page_numbers
A-1,Количество подъемов гласных,listed,A-1-2,Три,,,
A-2,Подъемы гласных,listed,A-2-3,"Верхний, средний и нижний",,,
A-3,Противопоставление по открытости/закрытости в подъемах гласных,not_stated,,,,,
A-4,Ряды гласных,listed,A-4-3,"Передний, средний (смешанный) и задний",,,
A-5,Наличие фонологических ступеней долготы,listed,A-5-2,Отсутствуют,,,
A-6,Фонологические ступени долготы,not_applicable,,,,,
A-7,Наличие противопоставления гласных по лабиализации,listed,A-7-1,Присутствует,,,
A-8,Противопоставление гласных по лабиализации,listed,A-8-4,В переднем и среднем рядах,,,
A-9,Наличие противопоставления гласных по назализации,listed,A-9-2,Отсутствует,,,
A-10,Противопоставление гласных по назализации,not_applicable,,,,,
A-11,Противопоставление гласных по фарингализации,not_stated,,,,,
A-12,Противопоставление гласных по продвинутости корня языка,not_stated,,,,,
A-13,Наличие дифтонгов и трифтонгов,listed,A-13-2,Только дифтонги,,,
A-14,Типы дифтонгов,listed,A-14-2,Нисходящие,,,
A-15,Инвентарь шумных согласных по ларингальным признакам,listed,A-15-1,Противопоставление по звонкости/глухости,Противопоставление по сонорности не охватывает передне- и заднеязычные спиранты.,,
A-16,Типы шумных согласных по способу артикуляции,listed,A-16-1,Взрывные и фрикативные,,,
A-17,Типы шумных согласных по месту образования,listed,A-17-2,"Губные, переднеязычные, палатальные, велярные/увулярные и ларингальные",,,
A-18,Типы шумных губных согласных по месту образования,listed,A-18-2,Губно-губные и губно-зубные,,,
A-19,Шумные переднеязычные согласные по месту образования,not_stated,,,"Шумные переднеязычные согласные /t/, /d/ и /s/ по месту образования не определены.",,
A-20,Типы шумных велярных и увулярных согласных по месту образования,listed,A-20-3,Велярные и увулярные,,,
A-21,Типы шумных ларингальных согласных по месту образования,listed,A-21-1,Только фарингальные,Фарингал /h/ представляет собой изолированную фонему со специфической локализацией.,,
A-22,Дополнительные артикуляционные противопоставления шумных согласных,listed,A-22-1,Отсутствуют,,,
A-23,Инвентарь сонорных согласных по способу артикуляции,listed,A-23-2,"Назальные, плавные и вибранты",,,
A-24,Инвентарь сонорных согласных по месту образования,listed,A-24-16,"Лабиальные, переднеязычные и заднеязычные",Дрожащий плавный реализуется как переднеязычный.,,
A-25,Дополнительные противопоставления сонорных согласных,listed,A-25-1,Отсутствуют,,,
A-26,Инвентарь фрикативных согласных по месту образования,not_stated,,,,,
B-1,Вид основной просодической единицы,not_stated,,,,,
B-2,Носитель просодической единицы,listed,B-2-1,Слог,,,
B-3,Характеристика просодической единицы по ее мотивации выбора акцентной вершины,not_stated,,,,,
B-4,Вид ударения (качественные характеристики),listed,B-4-1,Динамическое,,,
B-5,Фиксированность ударения,listed,B-5-2,Связанное,,,
B-6,Типы связанного ударения,not_stated,,,,,
B-7,Тип ударения при формообразовании (словоизменении),not_stated,,,,,
B-8,Тип строго фиксированного ударения (по положению в слове),not_stated,,,,,
B-9,Носители ограниченного (разноместного) ударения,not_stated,,,"Правила ударения такие же, как в нидерландском языке.",,
B-10,Виды тонем,not_stated,,,,,
B-11,Количество уровневых тонов (уровней регистровых (ровных) тонов),not_stated,,,,,
B-12,"Типы уровневого (регистрового, ровного) тона",not_stated,,,,,
B-13,Количество уровней контурных тонов,not_stated,,,,,
B-14,"Типы контурных (скользящих, модулярных, модулированных) тонем",not_stated,,,,,
B-15,Характер долготы,listed,B-15-2,Нефонологическая,,,
B-16,Область гармонического уподобления гласных,not_stated,,,,,
B-17,Признак гармонического уподобления гласных,not_stated,,,,,
B-18,Уподобляющий элемент при гармоническом уподоблении гласных,not_stated,,,,,
B-19,Прочие супрасегментные явления,custom,,"Палатализация, назализация, удлинение гласных и фонация",,,
B-20,Типы фонации,listed,B-20-6,Напряженная,,,
C-1,Начальный согласный в слоге,listed,C-1-5,Есть прикрытые и неприкрытые слоги,,,
C-2,Конечный согласный в слоге,listed,C-2-5,Есть закрытые и открытые слоги,"Количество открытых слогов больше, чем в нидерландском языке.",,
D-1,Ограничения на фонемную структуру сегментных морфем в начальной позиции,listed,D-1-7,Ограниченный набор гласных и согласных,,,
D-2,Ограничения на фонемную структуру сегментных морфем в конечной позиции,listed,D-2-1,Отсутствуют,,,
D-3,Особенности слогового состава слова,listed,D-3-3,Преимущественно односложные слова,,,
D-4,Различия между знаменательными и служебными словами,not_stated,,,,,
D-5,Различия между исконными и заимствованными словами,listed,D-5-1,Отсутствуют,,,
D-6,Различия между корневыми и аффиксальными морфемами,listed,D-6-2,Различия в фонетическом составе,,,
D-7,Функциональный тип чередований,listed,D-7-2,Сопутствующие,,,
D-8,Вид чередований,listed,D-8-8,"Вокалические, консонантные и смешанные",,,
E-1,Тип языка по способу соединения морфем в слове,listed,E-1-4,Флективный с элементами агглютинации,,,
E-2,Признаки флективного строя,listed,E-2-1,Внутренняя флексия,,,
E-3,Признаки агглютинативного строя,listed,E-3-7,Постоянство морфемного облика и совпадение исходной формы с чистой основой,Немногочисленные словоизменительные аффиксы имеют агглютинативный характер.,,
E-4,Тип языка по степени спаянности морфем,listed,E-4-2,Аналитический,,,
F-1,Количество согласовательных классов,listed,F-1-1,Согласовательные классы отсутствуют,,,
F-2,Морфологические способы выражения согласовательных классов,not_applicable,,,,,
F-3,Синтаксические способы выражения согласовательных классов,not_applicable,,,,,
F-4,Другие способы выражения согласовательных классов,not_applicable,,,,,
F-5,Атрибутивное согласование по роду,not_stated,,,,,
F-6,Согласование количественных числительных в роде,listed,F-6-1,Отсутствует,,,
F-7,Классифицирующие категории существительных,listed,F-7-1,Отсутствуют,,,
F-8,Противопоставление по личности/неличности,listed,F-8-5,Лексическое и синтаксическое,,,
F-9,Способ выражения одушевленности/неодушевленности,listed,F-9-4,Лексический и синтаксический,,,
G-1,Категория числа у существительных,listed,G-1-1,Единственное и множественное,,,
G-2,Маркирование единственного числа существительных,listed,G-2-2,Немаркированное,,,
G-3,Формы вежливости в местоимениях и глаголах,listed,G-3-2,Нейтральная и вежливая,,,
G-4,Согласование по числу,listed,G-4-1,Отсутствует,,,
G-5,Форма числа существительного в сочетании с числительными,listed,G-5-3,Единственное и множественное,,,
G-6,Система счисления,listed,G-6-1,Десятичная,,,
H-1,Количество падежей у имени существительного,listed,H-1-6,Категория падежа отсутствует,,,
H-2,Маркирование субъекта и объекта,listed,H-2-14,"Субъектная и объектная форма личных местоимений, предлоги и порядок слов",Личные местоимения сохраняют формы субъектного и объектного падежей только в ед.числе.,,
H-3,Падежное оформление именного сказуемого,not_applicable,,,,,
H-4,Падежное оформление посессивного отношения в именной группе,not_applicable,,,,,
H-5,Другие способы оформления посессивного отношения,listed,H-5-28,"Посессивные местоимения, предлоги и частицы",,,
H-6,Способ выражения пространственных отношений,custom,,"Местоимения, местоименные наречия, предлоги, приглагольные наречные элементы в составе глагольных словокомплексов",,,
H-7,Маркирование в посессивной конструкции,not_stated,,,,,
H-8,Падежное оформление одушевленных и неодушевленных имен существительных,not_applicable,,,,,
H-9,Наличие вторичных падежей,not_applicable,,,,,
I-1,Способ выражения залоговых форм в глаголе,listed,I-1-18,Вспомогательный глагол + причастие,,,
I-2,Возможность наложения нескольких залоговых форм,not_stated,,,,,
I-3,Двойные залоговые формы,not_stated,,,,,
I-4,Совпадение залоговых форм,not_stated,,,,,
I-5,Грамматические формы времени,listed,I-5-1&I-5-2&I-5-3,Прошедшее&Настоящее&Будущее,,,
I-6,Выражение вида и времени,listed,I-6-2,Синкретическое,,,
I-7,Способ выражения временных категорий,not_stated,,,,,
I-8,Синкретическое выражение нескольких глагольных значений,listed,I-8-14,"Время, вид и модальность (наклонение)",,,
I-9,Маркирование лица в глаголе в настоящем времени,listed,I-9-1,Отсутствует,,,
I-10,Маркер переходности,listed,I-10-11,Аффикс и значимое морфологическое чередование,,,
J-1,Наличие местоименных слов,listed,J-1-10,"Местоименные наречия, прилагательные и существительные",,,
J-2,Способы выражения дейктических категорий,listed,J-2-25,"Указательные местоимения, наречия, предлоги и артикли",,,
J-3,"Служебные части речи, выражающие пространственную ориентацию действия",listed,J-3-3,Предлоги,,,
J-4,"Знаменательные части речи, выражающие пространственную ориентацию действия",listed,J-4-6,Местоимения и наречия,,,
J-5,Морфологическое выражение определенности/неопределенности имени,listed,J-5-1,Отсутствует,,,
J-6,"Части речи, выражающие определенность/неопределенность имени",listed,J-6-1,Артикли,,,
J-7,Способы выражения форм вежливости,listed,J-7-3,В местоимениях,,,
J-8,Способы выражения отрицания,listed,J-8-15,"Отрицательные частицы, местоимения и наречия",Характерной чертой А.я. является двойное отрицание.,,
J-9,Позиция показателя отрицания,custom,,Одновременно препозиция и постпозиция по отношению ко всему предложению или к одному из его членов,,,
K-1,Склонение личных местоимений,listed,K-1-3,Собственный тип склонения,,,
K-2,Типы артиклей,listed,K-2-4,Определенный и неопределенный,,,
K-3,Неопределенный артикль и числительное «один»,listed,K-3-1,Совпадают,,,
K-4,Расположение артикля,listed,K-4-1,Препозиция,,,
K-5,Постановка артикля в именной группе,listed,K-5-1,Единый артикль для всей именной группы,,,
K-6,"Грамматические категории, выражаемые артиклем",custom,,Определенность/неопределенность,,,
K-7,Количество типов спряжения глаголов,listed,K-7-2,Два типа спряжения,Других данных нет.,,
K-8,Типы глагольного согласования,listed,K-8-1,Глагольное согласование отсутствует,,,
K-9,"Согласовательные категории, выражаемые причастием",listed,K-9-1,Отсутствуют,,,
K-10,"Время, выражаемое причастием",listed,K-10-6,Настоящее и прошедшее,,,
K-11,"Грамматические категории, выражаемые наречием",not_stated,,,,,
K-12,"Согласовательные категории, выражаемые прилагательным",listed,K-12-1,Отсутствуют,,,
K-13,Возможность кумулятивного выражения нескольких категорий в прилагательном,listed,K-13-1,Отсутствует,,,
K-14,Атрибутивное согласование прилагательных,listed,K-14-2,Отсутствует,,,
K-15,Типы атрибутивного согласования,not_stated,,,,,
K-16,"Изменяемые грамматические категории, выражаемые существительным",listed,K-16-4,Число,,,
K-17,Кумулятивное выражение нескольких категорий в существительном,listed,K-17-1,Отсутствует,,,
K-18,Средства словоизменения,custom,,"Внутренняя флексия, аффиксация, наращение и восстановление этимологического фонемного состава корневых морфем",,,
K-19,Модель словоформы,listed,K-19-4,Преимущественно или только суффиксальная,,,
L-1,Способы словообразования,listed,L-1-15,"Аффиксация, конверсия и редупликация",Словообразование А.я. радикально отличается от нидерландского и объединяется с морфологическим типом английского языка.,,
L-2,"Аффиксы, участвующие в словообразовании",listed,L-2-3,Префиксы и суффиксы,,,
L-3,Отношения между соединяемыми основами при сложении основ,not_stated,,,,,
M-1,Стратегия кодирования глагольных актантов,listed,M-1-3,Аккузативная,,,
M-2,Фиксированность порядка слов,listed,M-2-1,Жесткий,,,
M-3,Основной порядок слов в предложении,listed,M-3-1,SVO,,,
M-4,Порядок определения и определяемого,listed,M-4-3,Не фиксирован,Зависит от типа описательной определительной конструкции.,,
M-5,Опущение местоименного подлежащего в неэллиптических предложениях,not_stated,,,,,
N-1,Линейный порядок компонентов в сложном предложении,not_stated,,,,,
N-2,Особенности подчиненного компонента в сложном предложении,listed,N-2-3,Особый порядок слов,,,
N-3,Оформление сказуемого в придаточном предложении,listed,N-3-3,Финитные и нефинитные формы,,,
N-4,Тип построения сложного предложения,listed,N-4-4,Сочинение и подчинение,,,
N-5,Тип связи между элементами сложного предложения,listed,N-5-3,Союзная и бессоюзная,,,
_aux,,not_applicable,,,А.К.Зотова / О.И.Романова,,
