feature_id,feature_name_ru,value_type,value_id,value_ru,comment_ru,comment_en,page_numbers
A-1,Количество степеней подъема гласных,listed,A-1-3,Четыре,,,
A-2,Подъемы гласных,listed,A-2-1,Верхний и нижний,,,
A-3,Ряды гласных,listed,A-3-4,"Передний, средний и задний",,,
A-4,Фонологические ступени долготы,listed,A-4-2,Две ступени,,,
A-5,Противопоставление гласных по лабиализации,listed,A-5-1,Противопоставление гласных по лабиализации отсутствует,,,
A-6,Противопоставление гласных по назализации,listed,A-6-4,"В переднем, среднем и заднем рядах",,,
A-7,Противопоставление гласных по фарингализации,listed,A-7-1,Противопоставление гласных по фарингализации отсутствует,,,
A-8,Противопоставление гласных по продвинутости корня языка,listed,A-8-1,Противопоставление гласных по продвинутости корня языка отсутствует,,,
A-9,Наличие дифтонгов и трифтонгов,listed,A-9-2,Только дифтонги,,,
A-10,Типы дифтонгов,explicit_gap,,,,,
A-11,Инвентарь шумных согласных по ларингальным признакам,listed,A-11-6,Противопоставления по звонкости/глухости и по аспирации,,,
A-12,Инвентарь шумных согласных по способу артикуляции,listed,A-12-3,"Взрывные, фрикативные и аффрикаты",,,
A-13,Инвентарь шумных согласных по месту образования,listed,A-13-2,"Лабиальные, переднеязычные, среднеязычные, заднеязычные и постувулярные",,,
A-14,Инвентарь шумных губных согласных по месту образования,listed,A-14-1,Только билабиальные,,,
A-15,Шумные переднеязычные согласные по месту образования,listed,A-15-18,"Альвеолярные, ретрофлексные и альвео-палатальные",,,
A-16,Шумные заднеязычные согласные по месту образования,listed,A-16-1,Велярные,,,
A-17,Шумные постувулярные согласные по месту образования,listed,A-17-2,Только глоттальные,,,
A-18,Дополнительные артикуляционные противопоставления шумных согласных,listed,A-18-1,Отсутствуют,,,
A-19,Инвентарь сонорных согласных по способу артикуляции,listed,A-19-6,"Назальные, плавные, вибранты и глайды",,,
A-20,Инвентарь сонорных согласных по месту образования,custom,,"Губные, зубные, ретрофлексные и среднеязычные",,,
A-21,Дополнительные противопоставления сонорных согласных,listed,A-21-19,По аспирации,,,
B-1,Тип ударения,explicit_gap,,,,,
B-2,Вид ударения,explicit_gap,,,,,
B-3,Носитель ударения,explicit_gap,,,,,
B-4,Фиксированность ударения,explicit_gap,,,,,
B-5,Носитель фиксированного ударения в слове,explicit_gap,,,,,
B-6,Количество уровней тонов,not_stated,,,,,
B-7,Контурные признаки тона,not_stated,,,,,
B-8,Носитель тона,not_stated,,,,,
B-9,Характер долготы,explicit_gap,,,,,
B-10,Область гармонического уподобления гласных,not_stated,,,,,
B-11,Признак гармонического уподобления гласных,not_stated,,,,,
B-12,Уподобляющий элемент при гармоническом уподоблении гласных,not_stated,,,,,
B-13,Прочие супрасегментные явления,not_stated,,,,,
B-14,Типы фонации,not_stated,,,,,
C-1,Начальный согласный в слоге,explicit_gap,,,,,
C-2,Конечный согласный в слоге,explicit_gap,,,,,
D-1,Ограничения на фонемную структуру сегментных морфем в начальной позиции,explicit_gap,,,,,
D-2,Ограничения на фонемную структуру сегментных морфем в конечной позиции,explicit_gap,,,,,
D-3,Особенности слогового состава слова,explicit_gap,,,,,
D-4,Различия между знаменательными и служебными словами,explicit_gap,,,,,
D-5,Различия между исконными и заимствованными словами,explicit_gap,,,,,
D-6,Различия между корневыми и аффиксальными морфемами,explicit_gap,,,,,
D-7,Функциональный тип чередований,explicit_gap,,,,,
D-8,Вид чередований,explicit_gap,,,,,
E-1,Тип языка по способу соединения морфем в слове,listed,E-1-4,Флективный с элементами агглютинации,,,
E-2,Признаки флективного строя,explicit_gap,,,,,
E-3,Признаки агглютинативного строя,explicit_gap,,,,,
E-4,Тип языка по степени спаянности морфем,explicit_gap,,,,,
F-1,Количество согласовательных классов,custom,,Пять,,,
F-2,Морфологические способы выражения согласовательных классов,not_stated,,,,,
F-3,Синтаксические способы выражения согласовательных классов,listed,F-3-14,"В прилагательном, числительном и местоимении","Только у порядковых числительных, местоимения - только в некоторых говорах",,
F-4,Другие способы выражения согласовательных классов,not_stated,,,,,
F-5,Атрибутивное согласование по роду,listed,F-5-2,В единственном и множественном числе,,,
F-6,Согласование количественных числительных в роде,explicit_gap,,,,,
F-7,Классифицирующие категории существительных,custom,,"Есть 2 рода, которые распределены по 5 согласовательным классам",,,
F-8,Противопоставление по личности/неличности,not_stated,,,,,
F-9,Способ выражения одушевленности/неодушевленности,not_stated,,,,,
G-1,Категория числа у существительных,listed,G-1-1,Единственное и множественное,,,
G-2,Маркирование единственного числа существительных,explicit_gap,,,,,
G-3,Формы вежливости в местоимениях и глаголах,explicit_gap,,,,,
G-4,Согласование по числу,listed,G-4-4,Предикативное и атрибутивное,,,
G-5,Форма числа существительного в сочетании с числительными,explicit_gap,,,,,
G-6,Система счисления,explicit_gap,,,,,
G-7,"Неопределенный артикль и числительное «один»",not_applicable,,,,,
H-1,Количество падежей у имени существительного,listed,H-1-2,Три-семь,выделяется два падежа у существительных и три у некоторых местоимений,,
H-2,Маркирование субъекта и объекта,explicit_gap,,,,,
H-3,Падежное оформление именного сказуемого,explicit_gap,,,,,
H-4,Падежное оформление посессивного отношения в именной группе,explicit_gap,,,,,
H-5,Другие способы оформления посессивного отношения,not_stated,,,,,
H-6,Способ выражения пространственных отношений,explicit_gap,,,,,
H-7,Маркирование в посессивной конструкции,explicit_gap,,,,,
H-8,Падежное оформление одушевленных и неодушевленных имен существительных,explicit_gap,,,,,
H-9,Наличие вторичных падежей,not_stated,,,,,
I-1,Способ выражения залоговых форм в глаголе,listed,I-1-2,Вспомогательный глагол,,,
I-2,Возможность наложения нескольких залоговых форм,explicit_gap,,,,,
I-3,Двойные залоговые формы,explicit_gap,,,,,
I-4,Совпадение залоговых форм,explicit_gap,,,,,
I-5,Грамматические формы времени,listed,I-5-1&I-5-2&I-5-3,Прошедшее&Настоящее&Будущее,,,
I-6,Выражение вида и времени,explicit_gap,,,,,
I-7,Способ выражения временных категорий,listed,I-7-3,Вспомогательный глагол и аффиксы,,,
I-8,Синкретическое выражение нескольких глагольных значений,listed,I-8-21,"Род, лицо и число",,,
I-9,Маркирование лица в глаголе в настоящем времени,listed,I-9-3,В единственном и множественном числе,,,
I-10,Маркер переходности,listed,I-10-5,Особый тип согласования,,,
J-1,Наличие местоименных слов,listed,J-1-5,Местоименные прилагательные,,,
J-2,Способы выражения дейктических категорий,not_stated,,,,,
J-3,"Служебные части речи, выражающие пространственную ориентацию действия",not_stated,,,,,
J-4,"Знаменательные части речи, выражающие пространственную ориентацию действия",not_stated,,,,,
J-5,Морфологическое выражение определенности/неопределенности имени,listed,J-5-1,Отсутствует,,,
J-6,"Части речи, выражающие определенность/неопределенность имени",not_stated,,,,,
J-7,Способы выражения форм вежливости,not_stated,,,,,
J-8,Способы выражения отрицания,explicit_gap,,,,,
J-9,Позиция показателя отрицания,explicit_gap,,,,,
K-1,Склонение личных местоимений,listed,K-1-3,Собственный тип склонения,,,
K-2,Типы артиклей,listed,K-2-1,Артикли отсутствуют,,,
K-3,Расположение артикля,not_stated,,,,,
K-4,Постановка артикля в именной группе,not_stated,,,,,
K-5,"Грамматические категории, выражаемые артиклем",not_stated,,,,,
K-6,Количество типов спряжения глаголов,listed,K-6-1,Единый тип спряжения,,,
K-7,Типы глагольного согласования,listed,K-7-2,Субъектное,,,
K-8,"Согласовательные категории, выражаемые причастием",listed,K-8-7,"Род, число и падеж",,,
K-9,"Время, выражаемое причастием",explicit_gap,,,,,
K-10,"Грамматические категории, выражаемые наречием",explicit_gap,,,,,
K-11,"Согласовательные категории, выражаемые прилагательным",listed,K-11-10,"Род, число и падеж",,,
K-12,Возможность кумулятивного выражения нескольких категорий в прилагательном,listed,K-12-7,"Рода, числа и падежа",,,
K-13,Атрибутивное согласование прилагательных,listed,K-13-1,Всегда присутствует,,,
K-14,Типы атрибутивного согласования,listed,K-14-4&K-14-5&K-14-6,По роду&По числу&По падежу,,,
K-15,"Изменяемые грамматические категории, выражаемые существительным",listed,K-15-7,Число и падеж,,,
K-16,Кумулятивное выражение нескольких категорий в существительном,listed,K-16-11,"Рода / согласовательного класса, числа и падежа",,,
K-17,Средства словоизменения,listed,K-17-2,Аффиксы,,,
K-18,Модель словоформы,explicit_gap,,,,,
L-1,Способы словообразования,listed,L-1-6,Аффиксация,,,
L-2,"Аффиксы, участвующие в словообразовании",listed,L-2-3,Префиксы и суффиксы,,,
L-3,Отношения между соединяемыми основами при сложении основ,explicit_gap,,,,,
M-1,Стратегия кодирования глагольных актантов,listed,M-1-3,Аккузативная,,,
M-2,Фиксированность порядка слов,explicit_gap,,,,,
M-3,Основной порядок слов в предложении,listed,M-3-2,SOV,,,
M-4,Порядок определения и определяемого,listed,M-4-1,Определение предшествует определяемому,,,
M-5,Опущение местоименного подлежащего в неэллиптических предложениях,explicit_gap,,,,,
N-1,Линейный порядок компонентов в сложном предложении,explicit_gap,,,,,
N-2,Особенности подчиненного компонента в сложном предложении,explicit_gap,,,,,
N-3,Оформление сказуемого в придаточном предложении,explicit_gap,,,,,
N-4,Тип построения сложного предложения,explicit_gap,,,,,
N-5,Тип связи между элементами сложного предложения,explicit_gap,,,,,
A-210,Противопоставление по открытости/закрытости в подъемах гласных,not_stated,,,,,
A-220,Инвентарь фрикативных согласных по месту образования,not_stated,,,,,
_aux,,not_applicable,,,В.В.Дьячков,,
