feature_id,feature_name_ru,value_type,value_id,value_ru,comment_ru,comment_en
A-1,Количество степеней подъема,listed,A-1-3,Четыре,,
A-2,Подъемы гласных,listed,A-2-5,"Верхний, верхне-средний, нижне-средний и нижний",,
A-3,Ряды гласных,listed,A-3-2,Передний и задний,,
A-4,Фонологические ступени долготы,listed,A-4-1,Фонологические ступени долготы отсутствуют,,
A-5,Противопоставление гласных по лабиализации,listed,A-5-1,Противопоставление гласных по лабиализации отсутствует,,
A-6,Противопоставление гласных по назализации,listed,A-6-2,В переднем и заднем рядах,,
A-7,Противопоставление гласных по фарингализации,listed,A-7-1,Противопоставление гласных по фарингализации отсутствует,,
A-8,Противопоставление гласных по продвинутости корня языка,listed,A-8-1,Противопоставление гласных по продвинутости корня языка отсутствует,,
A-9,Наличие дифтонгов и трифтонгов,listed,A-9-2,Только дифтонги,,
A-10,Типы дифтонгов,not_stated,,,,
A-11,Инвентарь шумных согласных по ларингальным признакам,listed,A-11-1,Есть противопоставления по звонкости/глухости,,
A-12,Инвентарь шумных согласных по способу артикуляции,listed,A-12-1,Взрывные и фрикативные,,
A-13,Инвентарь шумных согласных по месту образования,listed,A-13-1,"Лабиальные, переднеязычные и заднеязычные",,
A-14,Инвентарь шумных губных согласных по месту образования,listed,A-14-2,Билабиальные и лабиодентальные,,
A-15,Шумные переднеязычные согласные по месту образования,listed,A-15-1,Дентальные,,
A-16,Шумные заднеязычные согласные по месту образования,listed,A-16-4,Велярные и лабиовелярные,,
A-17,Шумные постувулярные согласные по месту образования,not_stated,,,,
A-18,Дополнительные артикуляционные противопоставления шумных согласных,listed,A-18-1,Отсутствуют,,
A-19,Инвентарь сонорных согласных по способу артикуляции,listed,A-19-6,"Назальные, плавные, вибранты и глайды",,
A-20,Инвентарь сонорных согласных по месту образования,listed,A-20-17,"Лабиальные, переднеязычные, среднеязычные и заднеязычные",,
A-21,Дополнительные противопоставления сонорных согласных,listed,A-21-1,Отсутствуют,,
B-1,Тип ударения,listed,B-1-1,Ударение отсутствует,,
B-2,Вид ударения,not_stated,,,,
B-3,Носитель ударения,not_stated,,,,
B-4,Фиксированность ударения,not_stated,,,,
B-5,Носитель фиксированного ударения в слове,not_stated,,,,
B-6,Количество уровней тонов,listed,B-6-2,Три,,
B-7,Контурные признаки тона,custom,,"Ровный, восходящий, нисходящий и ""скользящий"" (в статье понятие не конкретизируется)",,
B-8,Носитель тона,listed,B-8-1,Слог,,
B-9,Характер долготы,custom,,Нет данных,,
B-10,Область гармонического уподобления гласных,not_stated,,,,
B-11,Признак гармонического уподобления гласных,not_stated,,,,
B-12,Уподобляющий элемент при гармоническом уподоблении гласных,not_stated,,,,
B-13,Прочие супрасегментные явления,not_stated,,,,
B-14,Типы фонации,not_stated,,,,
C-1,Начальный согласный в слоге,listed,C-1-3,Большинство слогов прикрытые,,
C-2,Конечный согласный в слоге,listed,C-2-4,Большинство слогов открытые,,
D-1,Ограничения на фонемную структуру сегментных морфем в начальной позиции,listed,D-1-1,Отсутствуют,,
D-2,Ограничения на фонемную структуру сегментных морфем в конечной позиции,listed,D-2-5,Ограниченный набор согласных,,
D-3,Особенности слогового состава слова,listed,D-3-3,Преимущественно односложные слова,,
D-4,Различия между знаменательными и служебными словами,listed,D-4-1,Отсутствуют,,
D-5,Различия между исконными и заимствованными словами,custom,,Нет данных,,
D-6,Различия между корневыми и аффиксальными морфемами,listed,D-6-1,Отсутствуют,,
D-7,Функциональный тип чередований,listed,D-7-2,Сопутствующие,,
D-8,Вид чередований,listed,D-8-2,Консонантные,,
E-1,Тип языка по способу соединения морфем в слове,listed,E-1-2,Агглютинативный с элементами флективного,,
E-2,Признаки флективного строя,listed,E-2-4,Фонетически необусловленная фузия,,
E-3,Признаки агглютинативного строя,not_stated,,,,
E-4,Тип языка по степени спаянности морфем,listed,E-4-2,Аналитический,,
F-1,Количество согласовательных классов,listed,F-1-1,Согласовательные классы отсутствуют,,
F-2,Морфологические способы выражения согласовательных классов,not_stated,,,,
F-3,Синтаксические способы выражения согласовательных классов,not_stated,,,,
F-4,Другие способы выражения согласовательных классов,not_stated,,,,
F-5,Атрибутивное согласование по роду,not_stated,,,,
F-6,Согласование количественных числительных в роде,not_stated,,,,
F-7,Классифицирующие категории существительных,listed,F-7-1,Отсутствуют,,
F-8,Противопоставление по личности/ неличности,not_stated,,,,
F-9,Способ выражения одушествленности/ неодушевленности,not_stated,,,,
G-1,Структура числа,listed,G-1-1,Единственное и множественное,,
G-2,Маркирование единственного числа,listed,G-2-2,Немаркированное,,
G-3,Гонорифические формы числа,listed,G-3-1,Отсутствуют,,
G-4,Согласование по числу,listed,G-4-1,Отсутствует,,
G-5,Форма имен после числительного,listed,G-5-1,Единственное число,,
G-6,Система счисления,listed,G-6-6,Двадцатеричная с элементами пятеричной,,
G-7,"Неопределенный артикль и числительное ""один""",listed,G-7-2,Совпадают,,
H-1,Количество падежей,listed,H-1-1,Один-два,,
H-2,Маркирование субъекта и объекта,listed,H-2-4,Служебные слова,,
H-3,Падежное оформление именного сказуемого,listed,H-3-4,Номинатив,,
H-4,Падежное оформление посессивного отношения,not_stated,,,,
H-5,Другие способы оформления посессивного отношения,listed,H-5-7,Соположение,,
H-6,Способ выражения пространственных отношений,not_stated,,,,
H-7,Маркирование зависимостного имени в генетивной конструкции,not_stated,,,,
H-8,Падежное оформление одушевленных и неодушевленных имен,listed,H-8-1,Одинаковое,,
H-9,Наличие вторичных падежей,listed,H-9-2,Отсутствуют,,
I-1,Способ выражения залоговых форм в глаголе,listed,I-1-1,Категория залога отсутствует,,
I-2,Возможность наложения нескольких залоговых форм,not_stated,,,,
I-3,Двойные залоговые формы,not_stated,,,,
I-4,Совпадение залоговых форм,not_stated,,,,
I-5,Основные временные противопоставления,custom,,Есть отдельные формы претерита и футурума,,
I-6,Выражение вида и времени,listed,I-6-2,Синкретическое,,
I-7,Способ выражения временных категорий,custom,,Отдельные формы местоименно-субъектных показателей,,
I-8,Синкретическое выражение нескольких глагольных значений,listed,I-8-1,Отсутствует,,
I-9,Маркирование лица в глаголе в настоящем времени,listed,I-9-1,Отсутствует,,
I-10,Маркер переходности,listed,I-10-1,Отсутствует,,
J-1,Наличие местоименных слов,not_stated,,,,
J-2,Способы выражения дейктических категорий,listed,J-2-7,Частицы,,
J-3,"Служебные части речи, выражающие пространственную ориентацию действия",listed,J-3-2,Послелоги,,
J-4,"Знаменательные части речи, выражающие пространственную ориентацию действия",not_stated,,,,
J-5,Морфологическое выражение определенности/неопределенности имени,listed,J-5-1,Отсутствует,,
J-6,"Части речи, выражающие определенность-неопределенность имени",listed,J-6-1,Артикли,,
J-7,Способы выражения форм вежливости,listed,J-7-3,В местоимениях,,
J-8,Способы выражения отрицания,listed,J-8-3,Отрицательные частицы,,
J-9,Позиция показателя отрицания,listed,J-9-4,Постпозиция,,
K-1,Склонение личных местоимений,listed,K-1-1,Местоимения не склоняются,,
K-2,Типы артиклей,listed,K-2-4,Определенные и неопределенные,,
K-3,Расположение артикля,listed,K-3-2,Постпозиция,,
K-4,Постановка артикля в именной группе,listed,K-4-1,Единый артикль для всей именной группы,,
K-5,"Грамматические категории, выражаемые артиклем",listed,K-5-2,Определенность,,
K-6,Количество типов спряжения глаголов,listed,K-6-1,Единый тип спряжения,,
K-7,Типы глагольного согласования,listed,K-7-1,Глагольное согласование отсутствует,,
K-8,"Согласовательные категории, выражаемые причастием",listed,K-8-1,Отсутствуют,,
K-9,"Время, выражаемое причастием",not_stated,,,,
K-10,"Грамматические категории, выражаемые наречием",not_stated,,,,
K-11,"Согласовательные категории, выражаемые прилагательным",listed,K-11-1,Отсутствуют,,
K-12,Возможность кумулятивного выражения нескольких категорий в прилагательном,listed,K-12-1,Отсутствует,,
K-13,Атрибутивное согласование прилагательных,listed,K-13-2,Отсутствует,,
K-14,Типы атрибутивного согласования,listed,K-14-1,Атрибутивное согласование отсутствует,,
K-15,"Изменяемые грамматические категории, выражаемые существительным",listed,K-15-4,Число,,
K-16,Кумулятивное выражение нескольких категорий в существительном,listed,K-16-1,Отсутствует,,
K-17,Средства словоизменения,listed,K-17-6,Редупликация и аффиксы,,
K-18,Модель словоформы,listed,K-18-4,Преимущественно или только суффиксальная,,
L-1,Способы словообразования,listed,L-1-19,"Аффиксация, редупликация и словосложение",,
L-2,"Аффиксы, участвующие в словообразовании",listed,L-2-3,Префиксы и суффиксы,,
L-3,Отношения между соединяемыми основами при сложении основ,custom,,Нет данных,,
M-1,Стратегия кодирования глагольных актантов,listed,M-1-3,Аккузативная,,
M-2,Фиксированность порядка слов,listed,M-2-1,Жесткий,,
M-3,Основной порядок слов в предложении,listed,M-3-2,SOV,,
M-4,Порядок определения и определяемого,listed,M-4-2,Определение следует за определямым,,
M-5,Опущение местоименного подлежащего в неэллиптических предложениях,custom,,Нет данных,,
N-1,Линейный порядок компонентов в сложном предложении,listed,N-1-3,Не фиксирован,,
N-2,Особенности подчиненного компонента в сложном предложении,not_stated,,,,
N-3,Оформления сказуемого в придаточном предложении,listed,N-3-3,Финитные и нефинитные формы,,
N-4,Тип построения сложного предложения,listed,N-4-4,Сочинение и подчинение,,
N-5,Тип связи между элементами сложного предложения,not_stated,,,,
