feature_id,feature_name_ru,value_type,value_id,value_ru,comment_ru,comment_en,page_numbers
A-1,Количество подъемов гласных,custom,,Список из пяти долгих и трех кратких гласных фонем по количеству степеней подъема терминологически не интерпретируется,Вымерший иранский язык. Языки-потомки отсутствуют.,,
A-2,Подъемы гласных,custom,,Список из пяти долгих и трех кратких гласных фонем по признаку подъема терминологически не интерпретируется,,,
A-3,Противопоставление по открытости/закрытости в подъемах гласных,not_stated,,,,,
A-4,Ряды гласных,listed,A-4-2,Передний и непередний / задний,,,
A-5,Наличие фонологических ступеней долготы,listed,A-5-1,Присутствуют,,,
A-6,Фонологические ступени долготы,listed,A-6-1,Две ступени,,,
A-7,Наличие противопоставления гласных по лабиализации,not_stated,,,,,
A-8,Противопоставление гласных по лабиализации,not_stated,,,Данных нет.,,
A-9,Наличие противопоставления гласных по назализации,not_stated,,,,,
A-10,Противопоставление гласных по назализации,custom,,Фонетический статус назализации гласных неясен,,,
A-11,Противопоставление гласных по фарингализации,not_stated,,,,,
A-12,Противопоставление гласных по продвинутости корня языка,not_stated,,,,,
A-13,Наличие дифтонгов и трифтонгов,listed,A-13-1,Дифтонги и трифтонги отсутствуют,,,
A-14,Типы дифтонгов,not_applicable,,,,,
A-15,Инвентарь шумных согласных по ларингальным признакам,listed,A-15-1,Противопоставление по звонкости/глухости,,,
A-16,Типы шумных согласных по способу артикуляции,custom,,Список из 26 согласных фонем по способу артикуляции терминологически не интерпретируется,,,
A-17,Типы шумных согласных по месту образования,custom,,Список из 26 согласных фонем по месту образования терминологически не интерпретируется,,,
A-18,Типы шумных губных согласных по месту образования,listed,A-18-2,Губно-губные и губно-зубные,,,
A-19,Шумные переднеязычные согласные по месту образования,not_stated,,,,,
A-20,Типы шумных велярных и увулярных согласных по месту образования,not_stated,,,,,
A-21,Типы шумных ларингальных согласных по месту образования,not_stated,,,,,
A-22,Дополнительные артикуляционные противопоставления шумных согласных,listed,A-22-3,По палатализации,,,
A-23,Инвентарь сонорных согласных по способу артикуляции,listed,A-23-6,"Назальные, плавные, вибранты и глайды",,,
A-24,Инвентарь сонорных согласных по месту образования,listed,A-24-14,"Лабиальные, переднеязычные и среднеязычные",,,
A-25,Дополнительные противопоставления сонорных согласных,listed,A-25-1,Отсутствуют,Других данных нет.,,
A-26,Инвентарь фрикативных согласных по месту образования,not_stated,,,,,
B-1,Вид основной просодической единицы,not_stated,,,,,
B-2,Носитель просодической единицы,listed,B-2-1,Слог,,,
B-3,Характеристика просодической единицы по ее мотивации выбора акцентной вершины,listed,B-3-3,Фонологическая и нефонологическая,,,
B-4,Вид ударения (качественные характеристики),listed,B-4-1,Динамическое,,,
B-5,Фиксированность ударения,listed,B-5-2,Связанное,,,
B-6,Типы связанного ударения,not_stated,,,,,
B-7,Тип ударения при формообразовании (словоизменении),not_stated,,,,,
B-8,Тип строго фиксированного ударения (по положению в слове),not_stated,,,,,
B-9,Носители ограниченного (разноместного) ударения,custom,,Основа или конечный гласный слова,,,
B-10,Виды тонем,not_stated,,,,,
B-11,Количество уровневых тонов (уровней регистровых (ровных) тонов),not_stated,,,,,
B-12,"Типы уровневого (регистрового, ровного) тона",not_stated,,,,,
B-13,Количество уровней контурных тонов,not_stated,,,,,
B-14,"Типы контурных (скользящих, модулярных, модулированных) тонем",not_stated,,,,,
B-15,Характер долготы,listed,B-15-4,Фонологическая и нефонологическая,,,
B-16,Область гармонического уподобления гласных,not_stated,,,Данных нет.,,
B-17,Признак гармонического уподобления гласных,not_stated,,,,,
B-18,Уподобляющий элемент при гармоническом уподоблении гласных,not_stated,,,,,
B-19,Прочие супрасегментные явления,custom,,Палатализация и растяжение гласных,,,
B-20,Типы фонации,not_stated,,,,,
C-1,Начальный согласный в слоге,listed,C-1-1,Обязательно имеется,"Структура слога трудно вычленима, т.к. в графике не фиксируются краткие гласные.",,
C-2,Конечный согласный в слоге,listed,C-2-4,Есть закрытые и открытые слоги,,,
C-3,Стечения согласных в слоге,not_stated,,,,,
D-1,Ограничения на фонемную структуру сегментных морфем в начальной позиции,not_stated,,,Данных нет.,,
D-2,Ограничения на фонемную структуру сегментных морфем в конечной позиции,not_stated,,,Данных нет.,,
D-3,Особенности слогового состава слова,not_stated,,,,,
D-4,Различия между знаменательными и служебными словами,not_stated,,,,,
D-5,Различия между исконными и заимствованными словами,not_stated,,,,,
D-6,Различия между корневыми и аффиксальными морфемами,not_stated,,,,,
D-7,Функциональный тип чередований,not_stated,,,Фонологический статус чередований неясен.,,
D-8,Вид чередований,listed,D-8-1,Вокалические,Других данных нет.,,
E-1,Тип языка по способу соединения морфем в слове,listed,E-1-5,Флективно-агглютинативный,,,
E-2,Признаки флективного строя,not_stated,,,,,
E-3,Признаки агглютинативного строя,not_stated,,,,,
E-4,Тип языка по степени спаянности морфем,listed,E-4-6,Синтетический с элементами аналитизма,,,
F-1,Количество согласовательных классов,listed,F-1-2,Два,,,
F-2,Морфологические способы выражения согласовательных классов,listed,F-2-1,Артикли,,,
F-3,Синтаксические способы выражения согласовательных классов,listed,F-3-3,В местоимении,,,
F-4,Другие способы выражения согласовательных классов,not_stated,,,,,
F-5,Атрибутивное согласование по роду,not_stated,,,,,
F-6,Согласование количественных числительных в роде,not_stated,,,Данных нет.,,
F-7,Классифицирующие категории существительных,not_stated,,,,,
F-8,Противопоставление по личности/неличности,not_stated,,,,,
F-9,Способ выражения одушевленности/неодушевленности,not_stated,,,,,
G-1,Категория числа у существительных,listed,G-1-1,Единственное и множественное,,,
G-2,Маркирование единственного числа существительных,not_stated,,,,,
G-3,Формы вежливости в местоимениях и глаголах,not_stated,,,,,
G-4,Согласование по числу,not_stated,,,,,
G-5,Форма числа существительного в сочетании с числительными,listed,G-5-3,Единственное и множественное,,,
G-6,Система счисления,not_stated,,,Данных нет.,,
H-1,Количество падежей у имени существительного,listed,H-1-2,Три-семь,,,
H-2,Маркирование субъекта и объекта,listed,H-2-3,Падежные аффиксы,Других данных нет.,,
H-3,Падежное оформление именного сказуемого,not_stated,,,,,
H-4,Падежное оформление посессивного отношения в именной группе,listed,H-4-1,Генитив,,,
H-5,Другие способы оформления посессивного отношения,custom,,Послелоги,,,
H-6,Способ выражения пространственных отношений,listed,H-6-12,Предлоги и послелоги,,,
H-7,Маркирование в посессивной конструкции,custom,,"Маркирование есть, требует уточнения",,,
H-8,Падежное оформление одушевленных и неодушевленных имен существительных,listed,H-8-1,Нет различий,Других данных нет.,,
H-9,Наличие вторичных падежей,not_stated,,,,,
I-1,Способ выражения залоговых форм в глаголе,not_stated,,,Данных нет.,,
I-2,Возможность наложения нескольких залоговых форм,not_stated,,,,,
I-3,Двойные залоговые формы,not_stated,,,,,
I-4,Совпадение залоговых форм,not_stated,,,,,
I-5,Грамматические формы времени,listed,I-5-1&I-5-5,Прошедшее&Непрошедшее (настоящее-будущее),,,
I-6,Выражение вида и времени,listed,I-6-2,Синкретическое,,,
I-7,Способ выражения временных категорий,custom,,"Тип оновы, аффиксы, аналитические конструкции причастие + вспомогательный глагол",,,
I-8,Синкретическое выражение нескольких глагольных значений,listed,I-8-17,"Лицо, число, время, вид и модальность (наклонение)",,,
I-9,Маркирование лица в глаголе в настоящем времени,listed,I-9-3,В единственном и множественном числе,,,
I-10,Маркер переходности,listed,I-10-5,Особый тип согласования,,,
J-1,Наличие местоименных слов,listed,J-1-11,Местоимения-существительные и местоимения-прилагательные,,,
J-2,Способы выражения дейктических категорий,listed,J-2-12,Указательные местоимения и артикли,,,
J-3,"Служебные части речи, выражающие пространственную ориентацию действия",custom,,"Предлоги, послелоги и поствербы",,,
J-4,"Знаменательные части речи, выражающие пространственную ориентацию действия",listed,J-4-4,Местоимения,,,
J-5,Морфологическое выражение определенности/неопределенности имени,listed,J-5-1,Отсутствует,,,
J-6,"Части речи, выражающие определенность/неопределенность имени",listed,J-6-1,Артикли,,,
J-7,Способы выражения форм вежливости,not_stated,,,,,
J-8,Способы выражения отрицания,listed,J-8-3,Отрицательные частицы,,,
J-9,Позиция показателя отрицания,listed,J-9-3,Препозиция,,,
K-1,Склонение личных местоимений,listed,K-1-3,Собственный тип склонения,,,
K-2,Артикли,listed,K-2-3,Только определенный,,,
K-3,Неопределенный артикль и числительное «один»,not_stated,,,,,
K-4,Расположение артикля,listed,K-4-1,Препозиция,,,
K-5,Постановка артикля в именной группе,custom,,Возможно повторное употребление артикля перед именем существительным и прилагательным в функции определения,,,
K-6,"Грамматические категории, выражаемые артиклем",listed,K-6-9,"Определенность, род и число",,,
K-7,Количество типов спряжения глаголов,not_stated,,,Данных нет.,,
K-8,Типы глагольного согласования,listed,K-8-2,Субъектное,,,
K-9,"Согласовательные категории, выражаемые причастием",not_stated,,,Данных нет.,,
K-10,"Время, выражаемое причастием",listed,K-10-4,Прошедшее,,,
K-11,"Грамматические категории, выражаемые наречием",not_stated,,,,,
K-12,"Согласовательные категории, выражаемые прилагательным",listed,K-12-6,Число,,,
K-13,Возможность кумулятивного выражения нескольких категорий в прилагательном,not_stated,,,,,
K-14,Атрибутивное согласование прилагательных,not_stated,,,,,
K-15,Типы атрибутивного согласования,listed,K-15-2&K-15-4,По числу&По роду,,,
K-16,"Изменяемые грамматические категории, выражаемые существительным",listed,K-16-7,Число и падеж,,,
K-17,Кумулятивное выражение нескольких категорий в существительном,listed,K-17-11,"Рода / согласовательного класса, числа и падежа",,,
K-18,Средства словоизменения,custom,,"Аффиксы, глагольные флексии и поствербы",,,
K-19,Модель словоформы,listed,K-19-4,Преимущественно или только суффиксальная,,,
L-1,Способы словообразования,listed,L-1-12,Аффиксация и словосложение,Словообразование изучено слабо.,,
L-2,"Аффиксы, участвующие в словообразовании",listed,L-2-2,Суффиксы,,,
L-3,Отношения между соединяемыми основами при сложении основ,not_stated,,,,,
M-1,Стратегия кодирования глагольных актантов,listed,M-1-3,Аккузативная,Других данных нет.,,
M-2,Фиксированность порядка слов,not_stated,,,,,
M-3,Основной порядок слов в предложении,listed,M-3-1,SVO,Порядок слов резко отличается от подавляющего большинства иранских языков.,,
M-4,Порядок определения и определяемого,listed,M-4-3,Не фиксирован,,,
M-5,Опущение местоименного подлежащего в неэллиптических предложениях,not_stated,,,,,
N-1,Линейный порядок компонентов в сложном предложении,not_stated,,,,,
N-2,Особенности подчиненного компонента в сложном предложении,not_stated,,,,,
N-3,Оформление сказуемого в придаточном предложении,not_stated,,,,,
N-4,Тип построения сложного предложения,listed,N-4-4,Сочинение и подчинение,Структура сложного предложения из-за фрагментарности текстов изучена слабо.,,
N-5,Тип связи между элементами сложного предложения,listed,N-5-2,Преобладает бессоюзная,,,
_aux,,not_applicable,,,А.К.Зотова,,
