feature_id,feature_name_ru,value_type,value_id,value_ru,comment_ru,comment_en,page_numbers
A-1,Количество степеней подъема,listed,A-1-3,Четыре,,,
A-2,Подъемы гласных,listed,A-2-6,"Верхний, средне-верхний, средне-нижний и нижний",,,
A-210,Противопоставление по открытости/закрытости в подъемах гласных,listed,A-210-2,В среднем,,,
A-3,Ряды гласных,listed,A-3-4,"Передний, средний (смешанный) и задний",,,
A-4,Фонологические ступени долготы,listed,A-4-2,Две ступени,"Отмечается, что вопрос дискуссионен",The problem is reported to be subject to discussion,
A-5,Противопоставление гласных по лабиализации,listed,A-5-1,Противопоставление гласных по лабиализации отсутствует,,,
A-6,Противопоставление гласных по назализации,listed,A-6-4,"В переднем, среднем и заднем рядах",,,
A-7,Противопоставление гласных по фарингализации,listed,A-7-1,Противопоставление гласных по фарингализации отсутствует,,,
A-8,Противопоставление гласных по продвинутости корня языка,listed,A-8-1,Противопоставление гласных по продвинутости корня языка отсутствует,,,
A-9,Наличие дифтонгов и трифтонгов,listed,A-9-2,Только дифтонги,,,
A-10,Типы дифтонгов,listed,A-10-2,Нисходящие,,,
A-11,Инвентарь шумных согласных по ларингальным признакам,listed,A-11-6,Противопоставления по звонкости/глухости и по аспирации,,,
A-12,Типы шумных согласных по способу артикуляции,listed,A-12-3,"Взрывные, фрикативные и аффрикаты",,,
A-13,Инвентарь шумных согласных по месту образования,listed,A-13-2,"Лабиальные, переднеязычные, среднеязычные, заднеязычные и постувулярные",,,
A-14,Типы шумных губных согласных по месту образования,listed,A-14-1,Только губно-губные,,,
A-15,Шумные переднеязычные согласные по месту образования,custom,,"Дентальные, ретрофлексные и альвеопалатальные",,,
A-16,Типы шумных велярных и увулярных согласных по месту образования,listed,A-16-1,Велярные,,,
A-17,Типы шумных ларингальных согласных по месту образования,listed,A-17-2,Только глоттальные,,,
A-18,Дополнительные артикуляционные противопоставления шумных согласных,listed,A-18-4,По палатализации,,,
A-19,Инвентарь сонорных согласных по способу артикуляции,listed,A-19-6,"Назальные, плавные, вибранты и глайды",,,
A-20,Инвентарь сонорных согласных по месту образования,listed,A-20-17,"Лабиальные, переднеязычные, среднеязычные и заднеязычные",,,
A-21,Дополнительные противопоставления сонорных согласных,listed,A-21-19,По аспирации,,,
A-220,Инвентарь фрикативных согласных по месту образования,not_applicable,,,,,
B-1,Тип ударения,listed,B-1-3,Нефонологическое,,,
B-2,Вид ударения,not_stated,,,,,
B-3,Носитель ударения,listed,B-3-1,Слог,,,
B-4,Фиксированность ударения,listed,B-4-3,Разноместно фиксированное,,,
B-5,Носитель фиксированного ударения в слове,listed,B-5-19,Любой слог слова,Зависит от качества последовательности слогов,Depends on the quality of syllable sequences,
B-6,Количество уровней тонов,listed,B-6-4,Тоны отсутствуют,,,
B-7,Контурные признаки тона,not_applicable,,,,,
B-8,Носитель тона,not_applicable,,,,,
B-9,Характер долготы,explicit_gap,,,,,
B-10,Область гармонического уподобления гласных,custom,,Фонологическое слово,,,
B-11,Признак гармонического уподобления гласных,listed,B-11-3,Подъем,,,
B-12,Уподобляющий элемент при гармоническом уподоблении гласных,listed,B-12-12,Гласный следующего слога,,,
B-13,Прочие супрасегментные явления,not_stated,,,,,
B-14,Типы фонации,not_stated,,,,,
C-1,Начальный согласный в слоге,listed,C-1-5,Есть прикрытые и неприкрытые слоги,,,
C-2,Конечный согласный в слоге,listed,C-2-5,Есть закрытые и открытые слоги,,,
D-1,Ограничения на фонемную структуру сегментных морфем в начальной позиции,listed,D-1-6,Запрет на любые стечения согласных,,,
D-2,Ограничения на фонемную структуру сегментных морфем в конечной позиции,listed,D-2-13,Ограничения на последовательность согласных,Зависит от гласного в слоге,Depends on aowel quality in a syllable,
D-3,Особенности слогового состава слова,not_stated,,,,,
D-4,Различия между знаменательными и служебными словами,not_stated,,,,,
D-5,Различия между исконными и заимствованными словами,not_stated,,,,,
D-6,Различия между корневыми и аффиксальными морфемами,explicit_gap,,,,,
D-7,Функциональный тип чередований,listed,D-7-4,Сопутствующие и смыслоразличительные,Есть непродуктивный аблаут, There is non-productive ablaut,
D-8,Вид чередований,listed,D-8-6,Вокалические и консонантные,,,
E-1,Тип языка по способу соединения морфем в слове,listed,E-1-2,Агглютинативный с элементами флективного,,,
E-2,Признаки флективного строя,listed,E-2-2,Кумулятивность аффиксов,,,
E-3,Признаки агглютинативного строя,not_stated,,,,,
E-4,Тип языка по степени спаянности морфем,not_stated,,,,,
F-1,Количество согласовательных классов,listed,F-1-3,Три,,,
F-2,Морфологические способы выражения согласовательных классов,listed,F-2-7,Именные флексии,,,
F-3,Синтаксические способы выражения согласовательных классов,listed,F-3-6,В прилагательном,,,
F-4,Другие способы выражения согласовательных классов,not_applicable,,,,,
F-5,Атрибутивное согласование по роду,listed,F-5-2,В единственном и множественном числе,,,
F-6,Согласование количественных числительных в роде,not_stated,,,,,
F-7,Классифицирующие категории существительных,listed,F-7-1,Отсутствуют,,,
F-8,Противопоставление по личности/неличности,not_stated,,,,,
F-9,Способ выражения одушевленности/неодушевленности,not_applicable,,,,,
G-1,Категория числа у существительных,listed,G-1-1,Единственное и множественное,,,
G-2,Маркирование единственного числа существительных,listed,G-2-3,Маркированное и немаркированное,Единственное и множественное число одинаково сложны морфологически,Singular and plural forms are equally complex,
G-3,Формы вежливости в местоимениях и глаголах,listed,G-3-2,Нейтральная и вежливая,,,
G-4,Согласование по числу,listed,G-4-3,Атрибутивное,Нет данных о предикативном согласовании,No data on predicate agreement,
G-5,Форма числа существительного в сочетании с числительными,not_stated,,,,,
G-6,Система счисления,not_stated,,,,,
H-1,Количество падежей у имени существительного,listed,H-1-2,Три-семь,,,
H-2,Маркирование субъекта и объекта,listed,H-2-5,Глагольное согласование и падежные аффиксы,,,
H-3,Падежное оформление именного сказуемого,listed,H-3-4,Номинатив,,,
H-4,Падежное оформление посессивного отношения в именной группе,listed,H-4-1,Генитив,,,
H-5,Другие способы оформления посессивного отношения,not_stated,,,,,
H-6,Способ выражения пространственных отношений,listed,H-6-11,Именные аффиксы и послелоги,,,
H-7,Маркирование в посессивной конструкции,custom,,"Маркирование есть, требует уточнения",,,
H-8,Падежное оформление одушевленных и неодушевленных имен существительных,listed,H-8-1,Нет различий,,,
H-9,Наличие вторичных падежей,listed,H-9-1,Имеются,,,
I-1,Способ выражения залоговых форм в глаголе,listed,I-1-4,Аффиксы,,,
I-2,Возможность наложения нескольких залоговых форм,not_stated,,,,,
I-3,Двойные залоговые формы,not_stated,,,,,
I-4,Совпадение залоговых форм,not_stated,,,,,
I-5,Грамматические формы времени,listed,I-5-1&I-5-2&I-5-3,Прошедшее&Настоящее&Будущее,,,
I-6,Выражение вида и времени,listed,I-6-1,Раздельное,,,
I-7,Способ выражения временных категорий,listed,I-7-1,Аффиксы,,,
I-8,Синкретическое выражение нескольких глагольных значений,custom,,"Лицо, число, время и модальность (наклонение)",,,
I-9,Маркирование лица в глаголе в настоящем времени,listed,I-9-3,В единственном и множественном числе,,,
I-10,Маркер переходности,listed,I-10-1,Отсутствует,,,
J-1,Наличие местоименных слов,listed,J-1-5,Местоименные прилагательные,,,
J-2,Способы выражения дейктических категорий,listed,J-2-1,Указательные местоимения,,,
J-3,"Служебные части речи, выражающие пространственную ориентацию действия",not_stated,,,,,
J-4,"Знаменательные части речи, выражающие пространственную ориентацию действия",listed,J-4-4,Местоимения,,,
J-5,Морфологическое выражение определенности/неопределенности имени,listed,J-5-5,Особая падежная форма,,,
J-6,"Части речи, выражающие определенность/неопределенность имени",listed,J-6-2,Местоимения,,,
J-7,Способы выражения форм вежливости,listed,J-7-3,В местоимениях,,,
J-8,Способы выражения отрицания,listed,J-8-4,Отрицательные глаголы,,,
J-9,Позиция показателя отрицания,listed,J-9-4,Постпозиция,,,
K-1,Склонение личных местоимений,listed,K-1-3,Собственный тип склонения,,,
K-2,Типы артиклей,listed,K-2-1,Артикли отсутствуют,,,
K-3,Неопределенный артикль и числительное «один»,listed,K-3-1,Совпадают,"Числительное ""один"" выражает неопределенность","The numeral ""one"" is used to express non-definiteness",
K-4,Расположение артикля,not_applicable,,,,,
K-5,Постановка артикля в именной группе,not_applicable,,,,,
K-6,"Грамматические категории, выражаемые артиклем",not_applicable,,,,,
K-7,Количество типов спряжения глаголов,listed,K-7-1,Единый тип спряжения,,,
K-8,Типы глагольного согласования,listed,K-8-2,Субъектное,,,
K-9,"Согласовательные категории, выражаемые причастием",listed,K-9-7,"Род, число и падеж",,,
K-10,"Время, выражаемое причастием",not_applicable,,,,,
K-11,"Грамматические категории, выражаемые наречием",not_stated,,,,,
K-12,"Согласовательные категории, выражаемые прилагательным",listed,K-12-10,"Род, число и падеж",,,
K-13,Возможность кумулятивного выражения нескольких категорий в прилагательном,listed,K-13-7,"Рода, числа и падежа",,,
K-14,Атрибутивное согласование прилагательных,listed,K-14-4,Факультативно,,,
K-15,Типы атрибутивного согласования,listed,K-15-4&K-15-2&K-15-3,По роду&По числу&По падежу,,,
K-16,"Изменяемые грамматические категории, выражаемые существительным",listed,K-16-7,Число и падеж,,,
K-17,Кумулятивное выражение нескольких категорий в существительном,listed,K-17-11,"Рода / согласовательного класса, числа и падежа",,,
K-18,Средства словоизменения,custom,,Аффиксы и клитики,,,
K-19,Модель словоформы,listed,K-19-4,Преимущественно или только суффиксальная,,,
L-1,Способы словообразования,listed,L-1-12,Аффиксация и словосложение,,,
L-2,"Аффиксы, участвующие в словообразовании",listed,L-2-2,Суффиксы,,,
L-3,Отношения между соединяемыми основами при сложении основ,not_stated,,,,,
M-1,Стратегия кодирования глагольных актантов,listed,M-1-10,Номинативная и эргативная,,,
M-2,Фиксированность порядка слов,listed,M-2-3,Относительно свободный,,,
M-3,Основной порядок слов в предложении,listed,M-3-2,SOV,,,
M-4,Порядок определения и определяемого,listed,M-4-1,Определение предшествует определяемому,,,
M-5,Опущение местоименного подлежащего в неэллиптических предложениях,not_stated,,,,,
N-1,Линейный порядок компонентов в сложном предложении,listed,N-1-2,Придаточное предшествует главному,,,
N-2,Особенности подчиненного компонента в сложном предложении,not_stated,,,,,
N-3,Оформление сказуемого в придаточном предложении,listed,N-3-3,Финитные и нефинитные формы,,,
N-4,Тип построения сложного предложения,listed,N-4-5,"Сочинение, подчинение и цепочки клауз",,,
N-5,Тип связи между элементами сложного предложения,listed,N-5-3,Союзная и бессоюзная,,,
_aux,,not_applicable,,,В.В.Дьячков,,
