feature_id,feature_name_ru,value_type,value_id,value_ru,comment_ru,comment_en,page_numbers
A-1,Количество подъемов гласных,listed,A-1-3,Четыре,Список из 7 гласных фонем по количеству степеней подъема терминологически не интерпретируется (только схема).,,
A-2,Подъемы гласных,listed,A-2-5,"Верхний, верхне-средний, нижне-средний и нижний",На основании схемы. Других данных нет.,,
A-3,Противопоставление по открытости/закрытости в подъемах гласных,not_stated,,,,,
A-4,Ряды гласных,listed,A-4-3,"Передний, средний (смешанный) и задний",На основании схемы. Других данных нет.,,
A-5,Наличие фонологических ступеней долготы,listed,A-5-1,Присутствуют,,,
A-6,Фонологические ступени долготы,listed,A-6-1,Две ступени,,,
A-7,Наличие противопоставления гласных по лабиализации,not_stated,,,,,
A-8,Противопоставление гласных по лабиализации,not_stated,,,,,
A-9,Наличие противопоставления гласных по назализации,listed,A-9-2,Отсутствует,,,
A-10,Противопоставление гласных по назализации,not_applicable,,,,,
A-11,Противопоставление гласных по фарингализации,not_stated,,,,,
A-12,Противопоставление гласных по продвинутости корня языка,not_stated,,,,,
A-13,Наличие дифтонгов и трифтонгов,listed,A-13-2,Только дифтонги,,,
A-14,Типы дифтонгов,listed,A-14-2,Нисходящие,,,
A-15,Инвентарь шумных согласных по ларингальным признакам,listed,A-15-1,Противопоставление по звонкости/глухости,,,
A-16,Типы шумных согласных по способу артикуляции,custom,,"Смычные: чистые (неносовые и носовые), аффрикаты (одно- и двухфокусные); щелевые: срединные (одно- и двухфокусные) и боковые; дрожащие",,,
A-17,Типы шумных согласных по месту образования,listed,A-17-2,"Губные, переднеязычные, палатальные, велярные/увулярные и ларингальные",,,
A-18,Типы шумных губных согласных по месту образования,listed,A-18-2,Губно-губные и губно-зубные,,,
A-19,Шумные переднеязычные согласные по месту образования,custom,,Нецеребральные и церебральные,,,
A-20,Типы шумных велярных и увулярных согласных по месту образования,listed,A-20-3,Велярные и увулярные,,,
A-21,Типы шумных ларингальных согласных по месту образования,listed,A-21-1,Только фарингальные,,,
A-22,Дополнительные артикуляционные противопоставления шумных согласных,not_stated,,,,,
A-23,Инвентарь сонорных согласных по способу артикуляции,listed,A-23-6,"Назальные, плавные, вибранты и глайды",,,
A-24,Инвентарь сонорных согласных по месту образования,listed,A-24-14,"Лабиальные, переднеязычные и среднеязычные",,,
A-25,Дополнительные противопоставления сонорных согласных,not_stated,,,,,
A-26,Инвентарь фрикативных согласных по месту образования,not_stated,,,,,
B-1,Вид основной просодической единицы,not_stated,,,,,
B-2,Носитель просодической единицы,listed,B-2-1,Слог,,,
B-3,Характеристика просодической единицы по ее мотивации выбора акцентной вершины,listed,B-3-3,Фонологическая и нефонологическая,,,
B-4,Вид ударения (качественные характеристики),listed,B-4-1,Динамическое,,,
B-5,Фиксированность ударения,listed,B-5-2,Связанное,,,
B-6,Типы связанного ударения,not_stated,,,,,
B-7,Тип ударения при формообразовании (словоизменении),not_stated,,,,,
B-8,Тип строго фиксированного ударения (по положению в слове),not_stated,,,,,
B-9,Носители ограниченного (разноместного) ударения,custom,,Неприменимо,,,
B-10,Виды тонем,not_stated,,,,,
B-11,Количество уровневых тонов (уровней регистровых (ровных) тонов),not_stated,,,,,
B-12,"Типы уровневого (регистрового, ровного) тона",not_stated,,,,,
B-13,Количество уровней контурных тонов,not_stated,,,,,
B-14,"Типы контурных (скользящих, модулярных, модулированных) тонем",not_stated,,,,,
B-15,Характер долготы,listed,B-15-4,Фонологическая и нефонологическая,,,
B-16,Область гармонического уподобления гласных,not_stated,,,,,
B-17,Признак гармонического уподобления гласных,not_stated,,,,,
B-18,Уподобляющий элемент при гармоническом уподоблении гласных,not_stated,,,,,
B-19,Прочие супрасегментные явления,listed,B-19-1,Назализация,,,
B-20,Типы фонации,not_stated,,,,,
C-1,Начальный согласный в слоге,listed,C-1-4,Есть прикрытые и неприкрытые слоги,,,
C-2,Конечный согласный в слоге,listed,C-2-4,Есть закрытые и открытые слоги,,,
C-3,Стечения согласных в слоге,not_stated,,,,,
D-1,Ограничения на фонемную структуру начала слова,not_stated,,,,,
D-2,Тип ограничений на фонемную структуру начала слова (анлауте),not_stated,,,,,
D-3,Тип ограничений  на фонемную структуру в конце слова (ауслауте),not_stated,,,,,
D-4,Варианты особенностей слогового состава слова,not_stated,,,,,
D-5,Типы различий между знаменательными и служебными словами,not_stated,,,,,
D-6,Типы различий между исконными и заимствованными словами,listed,D-6-1,Различия в фонетическом составе,,,
D-7,Типы различий между корневыми и аффиксальными морфемами,listed,D-7-2,Акцентные различия,,,
D-8,Функциональный тип чередований,listed,D-8-4,Сопутствующие и смыслоразличительные,,,
D-9,Вид чередований,listed,D-9-10,"Вокалические, консонантные, смешанные и чередование комплексов",,,
E-1,Тип языка по способу соединения морфем в слове,listed,E-1-4,Флективный с элементами агглютинации,,,
E-2,Признаки флективного строя,listed,E-2-10,Внутренняя флексия и кумулятивность флексий,,,
E-3,Признаки агглютинативного строя,not_stated,,,,,
E-4,Тип языка по степени спаянности морфем,listed,E-4-6,Синтетический с элементами аналитизма,,,
F-1,Количество согласовательных классов,listed,F-1-2,Два,,,
F-2,Морфологические способы выражения согласовательных классов,custom,,"Аффиксация у существительных, прилагательных, числительных и глаголов",,,
F-3,Синтаксические способы выражения согласовательных классов,listed,F-3-11,"В прилагательном, числительном, местоимении и глаголе",,,
F-4,Другие способы выражения согласовательных классов,not_stated,,,,,
F-5,Атрибутивное согласование по роду,listed,F-5-2,В единственном и множественном числе,,,
F-6,Согласование количественных числительных в роде,listed,F-6-3,"Для числительного ""один""",,,
F-7,Классифицирующие категории существительных,not_stated,,,,,
F-8,Противопоставление по личности/неличности,listed,F-8-7,"Лексическое, морфологическое и синтаксическое",,,
F-9,Способ выражения одушевленности/неодушевленности,listed,F-9-6,Лексический и морфологический,,,
G-1,Категория числа у существительных,listed,G-1-1,Единственное и множественное,,,
G-2,Маркирование единственного числа существительных,not_stated,,,,,
G-3,Формы вежливости в местоимениях и глаголах,not_stated,,,,,
G-4,Согласование по числу,listed,G-4-4,Предикативное и атрибутивное,,,
G-5,Форма числа существительного в сочетании с числительными,listed,G-5-3,Единственное и множественное,,,
G-6,Система счисления,not_stated,,,,,
H-1,Количество падежей у имени существительного,listed,H-1-1,Один-два,Ряд существительных и прилагательных имеют также формы II косвенного и/или звательного падежей.,,
H-2,Маркирование субъекта и объекта,listed,H-2-11,"Объектная форма местоимений, служебные слова, падежные аффиксы и глагольное согласование",,,
H-3,Падежное оформление именного сказуемого,not_stated,,,,,
H-4,Падежное оформление посессивного отношения в именной группе,custom,,Косвенный падеж с предлогами,,,
H-5,Другие способы оформления посессивного отношения,custom,,"Притяжательные местоимения, местоименные энклитики и предлоги",,,
H-6,Способ выражения пространственных отношений,custom,,"Лично-направительные местоимения, наречия места,  предлоги и послелоги",,,
H-7,Маркирование в посессивной конструкции,not_stated,,,,,
H-8,Падежное оформление одушевленных и неодушевленных имен существительных,not_stated,,,,,
H-9,Наличие вторичных падежей,not_stated,,,,,
I-1,Способ выражения залоговых форм в глаголе,custom,,Вспомогательный глагол + инфинитив/причастие прошедшего времени,,,
I-2,Возможность наложения нескольких залоговых форм,not_stated,,,,,
I-3,Двойные залоговые формы,not_stated,,,,,
I-4,Совпадение залоговых форм,not_stated,,,,,
I-5,Грамматические формы времени,listed,I-5-1&I-5-2&I-5-3,Прошедшее&Настоящее&Будущее,,,
I-6,Выражение вида и времени,listed,I-6-2,Синкретическое,,,
I-7,Способ выражения временных категорий,listed,I-7-3,Вспомогательный глагол и аффиксы,,,
I-8,Синкретическое выражение нескольких глагольных значений,listed,I-8-19,"Лицо, число, род, время, вид и модальность (наклонение)",,,
I-9,Маркирование лица в глаголе в настоящем времени,listed,I-9-3,В единственном и множественном числе,,,
I-10,Маркер переходности,not_stated,,,,,
J-1,Наличие местоименных слов,listed,J-1-10,"Местоименные наречия, прилагательные и существительные",,,
J-2,Способы выражения дейктических категорий,listed,J-2-16,"Указательные местоимения, предлоги и послелоги",,,
J-3,"Служебные части речи, выражающие пространственную ориентацию действия",listed,J-3-9,Предлоги и послелоги,,,
J-4,"Знаменательные части речи, выражающие пространственную ориентацию действия",listed,J-4-6,Местоимения и наречия,,,
J-5,Морфологическое выражение определенности/неопределенности имени,listed,J-5-1,Отсутствует,,,
J-6,"Части речи, выражающие определенность/неопределенность имени",listed,J-6-16,Числительные и местоимения,,,
J-7,Способы выражения форм вежливости,not_stated,,,,,
J-8,Способы выражения отрицания,custom,,Отрицательные префиксы (в глагольных формах) и отрицательные местоимения,,,
J-9,Позиция показателя отрицания,listed,J-9-3,Препозиция,,,
K-1,Склонение личных местоимений,listed,K-1-3,Собственный тип склонения,,,
K-2,Типы артиклей,listed,K-2-1,Артикли отсутствуют,,,
K-3,Неопределенный артикль и числительное «один»,not_stated,,,,,
K-4,Расположение артикля,not_applicable,,,,,
K-5,Постановка артикля в именной группе,not_applicable,,,,,
K-6,"Грамматические категории, выражаемые артиклем",not_applicable,,,,,
K-7,Количество типов спряжения глаголов,listed,K-7-4,Четыре типа спряжения,,,
K-8,Типы глагольного согласования,listed,K-8-3,Субъектное и объектное,,,
K-9,"Согласовательные категории, выражаемые причастием",custom,,Отсутствуеют (у потенциальных причастий) и род и число (у причастий прошедшего времени),,,
K-10,"Время, выражаемое причастием",listed,K-10-6,Настоящее и прошедшее,,,
K-11,"Грамматические категории, выражаемые наречием",not_stated,,,,,
K-12,"Согласовательные категории, выражаемые прилагательным",listed,K-12-10,"Род, число и падеж",,,
K-13,Возможность кумулятивного выражения нескольких категорий в прилагательном,listed,K-13-7,"Рода, числа и падежа",,,
K-14,Атрибутивное согласование прилагательных,custom,,В зависимости от морфологического класса прилагательного,,,
K-15,Типы атрибутивного согласования,listed,K-15-2&K-15-3&K-15-4,По числу&По падежу&По роду,,,
K-16,"Изменяемые грамматические категории, выражаемые существительным",listed,K-16-7,Число и падеж,,,
K-17,Кумулятивное выражение нескольких категорий в существительном,listed,K-17-11,"Рода / согласовательного класса, числа и падежа",,,
K-18,Средства словоизменения,custom,,Внешняя и внутренняя флексия и аффиксы,,,
K-19,Модель словоформы,listed,K-19-1,Префиксально-суффиксальная,,,
L-1,Способы словообразования,custom,,"Аффиксвция, словосложение и редупликация",,,
L-2,"Аффиксы, участвующие в словообразовании",listed,L-2-3,Префиксы и суффиксы,,,
L-3,Отношения между соединяемыми основами при сложении основ,custom,,Копулятивный и детерминативный типы основосложения,,,
M-1,Стратегия кодирования глагольных актантов,custom,,Номинативно-эргативная,,,
M-2,Фиксированность порядка слов,listed,M-2-1,Жесткий,,,
M-3,Основной порядок слов в предложении,listed,M-3-2,SOV,,,
M-4,Порядок определения и определяемого,listed,M-4-1,Определение предшествует определяемому,,,
M-5,Опущение местоименного подлежащего в неэллиптических предложениях,not_stated,,,,,
N-1,Линейный порядок компонентов в сложном предложении,not_stated,,,,,
N-2,Особенности подчиненного компонента в сложном предложении,not_stated,,,,,
N-3,Оформление сказуемого в придаточном предложении,not_stated,,,,,
N-4,Тип построения сложного предложения,listed,N-4-4,Сочинение и подчинение,,,
N-5,Тип связи между элементами сложного предложения,listed,N-5-3,Союзная и бессоюзная,,,
_aux,,not_applicable,,,А.К.Зотова,,
