feature_id,feature_name_ru,value_type,value_id,value_ru,comment_ru,comment_en,page_numbers
A-1,Количество подъемов гласных,listed,A-1-2,Три,,,
A-2,Подъемы гласных,listed,A-2-3,"Верхний, средний и нижний",,,
A-3,Противопоставление по открытости/закрытости в подъемах гласных,not_stated,,,,,
A-4,Ряды гласных,listed,A-4-3,"Передний, средний (смешанный) и задний",,,
A-5,Наличие фонологических ступеней долготы,listed,A-5-2,Отсутствуют,,,
A-6,Фонологические ступени долготы,not_applicable,,,,,
A-7,Наличие противопоставления гласных по лабиализации,listed,A-7-2,Отсутствует,,,
A-8,Противопоставление гласных по лабиализации,not_applicable,,,,,
A-9,Наличие противопоставления гласных по назализации,listed,A-9-2,Отсутствует,,,
A-10,Противопоставление гласных по назализации,not_applicable,,,,,
A-11,Противопоставление гласных по фарингализации,not_stated,,,,,
A-12,Противопоставление гласных по продвинутости корня языка,listed,A-12-1,Противопоставление гласных по продвинутости корня языка отсутствует,,,
A-13,Наличие дифтонгов и трифтонгов,listed,A-13-1,Дифтонги и трифтонги отсутствуют,,,
A-14,Типы дифтонгов,not_applicable,,,,,
A-15,Инвентарь шумных согласных по ларингальным признакам,listed,A-15-9,Противопоставления по звонкости/глухости и твердости/мягкости,,,
A-16,Типы шумных согласных по способу артикуляции,listed,A-16-3,"Взрывные, аффрикаты и фрикативные",,,
A-17,Типы шумных согласных по месту образования,listed,A-17-3,"Губные, переднеязычные, палатальные и велярные/увулярные",,,
A-18,Типы шумных губных согласных по месту образования,listed,A-18-2,Губно-губные и губно-зубные,,,
A-19,Шумные переднеязычные согласные по месту образования,listed,A-19-30,Дентальные и передненебные,,,
A-20,Типы шумных велярных и увулярных согласных по месту образования,custom,,Средненебные и задненебные,,,
A-21,Типы шумных ларингальных согласных по месту образования,not_stated,,,,,
A-22,Дополнительные артикуляционные противопоставления шумных согласных,listed,A-22-1,Отсутствуют,,,
A-23,Инвентарь сонорных согласных по способу артикуляции,listed,A-23-6,"Назальные, плавные, вибранты и глайды",,,
A-24,Инвентарь сонорных согласных по месту образования,custom,,"Лабиальные, переднеязычные (передненебные) и среднеязычные (средненебные)",,,
A-25,Дополнительные противопоставления сонорных согласных,listed,A-25-1,Отсутствуют,,,
A-26,Инвентарь фрикативных согласных по месту образования,not_stated,,,,,
B-1,Вид основной просодической единицы,not_stated,,,,,
B-2,Носитель просодической единицы,listed,B-2-1,Слог,,,
B-3,Характеристика просодической единицы по ее мотивации выбора акцентной вершины,listed,B-3-1,Фонологическая,,,
B-4,Вид ударения (качественные характеристики),listed,B-4-1,Динамическое,,,
B-5,Фиксированность ударения,listed,B-5-2,Связанное,,,
B-6,Типы связанного ударения,not_stated,,,,,
B-7,Тип ударения при формообразовании (словоизменении),not_stated,,,,,
B-8,Тип строго фиксированного ударения (по положению в слове),not_stated,,,,,
B-9,Носители ограниченного (разноместного) ударения,not_stated,,,,,
B-10,Виды тонем,not_stated,,,,,
B-11,Количество уровневых тонов (уровней регистровых (ровных) тонов),not_stated,,,,,
B-12,"Типы уровневого (регистрового, ровного) тона",not_stated,,,,,
B-13,Количество уровней контурных тонов,not_stated,,,,,
B-14,"Типы контурных (скользящих, модулярных, модулированных) тонем",not_stated,,,,,
B-15,Характер долготы,listed,B-15-2,Нефонологическая,,,
B-16,Область гармонического уподобления гласных,not_stated,,,,,
B-17,Признак гармонического уподобления гласных,not_stated,,,,,
B-18,Уподобляющий элемент при гармоническом уподоблении гласных,not_stated,,,,,
B-19,Прочие супрасегментные явления,custom,,"Редукция и расширение гласных, оглушение, смягчение, отвердение согласных и принцип восходящей звучности слога",,,
B-20,Типы фонации,not_stated,,,,,
C-1,Начальный согласный в слоге,listed,C-1-4,Есть прикрытые и неприкрытые слоги,,,
C-2,Конечный согласный в слоге,listed,C-2-4,Есть закрытые и открытые слоги,,,
C-3,Стечения согласных в слоге,not_stated,,,,,
D-1,Тип ограничений на фонемную структуру начала слова (анлауте),listed,D-1-4,Ограниченный набор согласных,,,
D-2,Тип ограничений  на фонемную структуру в конце слова (ауслауте),listed,D-2-4,Ограниченный набор согласных,,,
D-3,Варианты особенностей слогового состава слова,not_stated,,,,,
D-4,Типы различий между знаменательными и служебными словами,custom,,Отсутствуют,,,
D-5,Типы различий между исконными и заимствованными словами,custom,,Отсутствуют,,,
D-6,Различия между корневыми и аффиксальными морфемами,custom,,Отсутствуют,,,
D-7,Функциональный тип чередований,listed,D-7-4,Сопутствующие и смыслоразличительные,,,
D-8,Вид чередований,listed,D-8-11,"Вокалические, консонантные и чередования комплексов",,,
E-1,Тип языка по способу соединения морфем в слове,listed,E-1-3,Флективный,,,
E-2,Признаки флективного строя,listed,E-2-7,Фонетически необусловленные изменения в основе и кумулятивность аффиксов,,,
E-3,Признаки агглютинативного строя,not_stated,,,Ограниченно представлены элементы агглютинации: некоторые постфиксы присоединяются к целой словоформе.,,
E-4,Тип языка по степени спаянности морфем,listed,E-4-5,Синтетический,,,
F-1,Количество согласовательных классов,custom,,Семь,В Р.я. три грамматических рода и семь согласовательных классов по признакам рода и одушевленности/неодушевленности.,,
F-2,Морфологические способы выражения согласовательных классов,listed,F-2-9,Флексии в имени и глаголе,,,
F-3,Синтаксические способы выражения согласовательных классов,listed,F-3-17,"В прилагательном, числительном, местоимении, глаголе и причастии",,,
F-4,Другие способы выражения согласовательных классов,not_stated,,,,,
F-5,Атрибутивное согласование по роду,listed,F-5-2,В единственном и множественном числе,,,
F-6,Согласование количественных числительных в роде,custom,,"Для числительных ""один"", ""два"", ""оба"" и ""полтора""",,,
F-7,Классифицирующие категории существительных,listed,F-7-3,Одушевленность/неодушевленность,,,
F-8,Противопоставление по личности/неличности,listed,F-8-4,Лексическое и морфологическое,,,
F-9,Способ выражения одушевленности/неодушевленности,listed,F-9-7,"Лексический, морфологический и синтаксический",,,
G-1,Категория числа у существительных,listed,G-1-1,Единственное и множественное,,,
G-2,Маркирование единственного числа существительных,listed,G-2-2,Немаркированное,,,
G-3,Формы вежливости в местоимениях и глаголах,listed,G-3-2,Нейтральная и вежливая,,,
G-4,Согласование по числу,listed,G-4-4,Предикативное и атрибутивное,,,
G-5,Форма числа существительного в сочетании с числительными,listed,G-5-3,Единственное и множественное,,,
G-6,Система счисления,listed,G-6-1,Десятичная,,,
H-1,Количество падежей у имени существительного,listed,H-1-2,Три-семь,,,
H-2,Маркирование субъекта и объекта,custom,,"Субъектная и объектная форма местоимений, падежные аффиксы и глагольное согласование",,,
H-3,Падежное оформление именного сказуемого,custom,,Творительный падеж,,,
H-4,Падежное оформление посессивного отношения в именной группе,listed,H-4-1,Генитив,,,
H-5,Другие способы оформления посессивного отношения,listed,H-5-26,Посессивные местоимения и аффиксы,,,
H-6,Способ выражения пространственных отношений,custom,,"Местоимения, местоименные наречия, именные аффиксы, предложно-именные конструкции и предлоги",,,
H-7,Маркирование в посессивной конструкции,custom,,"Маркирование есть, требует уточнения",,,
H-8,Падежное оформление одушевленных и неодушевленных имен существительных,listed,H-8-2,Есть различия,,,
H-9,Наличие вторичных падежей,listed,H-9-2,Отсутствуют,,,
I-1,Способ выражения залоговых форм в глаголе,custom,,Причастие и постфиксы,,,
I-2,Возможность наложения нескольких залоговых форм,listed,I-2-1,Присутствует,,,
I-3,Двойные залоговые формы,not_stated,,,,,
I-4,Совпадение залоговых форм,listed,I-4-4,Пассив и рефлексив,,,
I-5,Грамматические формы времени,listed,I-5-1&I-5-2&I-5-3,Прошедшее&Настоящее&Будущее,,,
I-6,Выражение вида и времени,listed,I-6-2,Синкретическое,,,
I-7,Способ выражения временных категорий,listed,I-7-3,Вспомогательный глагол и аффиксы,,,
I-8,Синкретическое выражение нескольких глагольных значений,listed,I-8-19,"Лицо, число, род, время, вид и модальность (наклонение)",,,
I-9,Маркирование лица в глаголе в настоящем времени,listed,I-9-3,В единственном и множественном числе,,,
I-10,Маркер переходности,listed,I-10-8,Аффикс и особый тип согласования,,,
J-1,Наличие местоименных слов,listed,J-1-13,"Местоимения-существительные, местоимения-прилагательные, местоименные наречия и местоименные числительные",,,
J-2,Способы выражения дейктических категорий,custom,,"Личные, указательные, вопросительные и относительные местоимения и местоименные наречия",,,
J-3,"Служебные части речи, выражающие пространственную ориентацию действия",listed,J-3-3,Предлоги,,,
J-4,"Знаменательные части речи, выражающие пространственную ориентацию действия",listed,J-4-7,"Прилагательные, местоимения и наречия",,,
J-5,Морфологическое выражение определенности/неопределенности имени,listed,J-5-1,Отсутствует,,,
J-6,"Части речи, выражающие определенность/неопределенность имени",custom,,"Прилагательные, местоимения, числительные и частицы",,,
J-7,Способы выражения форм вежливости,listed,J-7-9,"В глагольной группе, местоимениях и синтаксически",,,
J-8,Способы выражения отрицания,listed,J-8-28,"Отрицательные частицы, аффиксы, местоимения и наречия",Существует двойное и тройное отрицание.,,
J-9,Позиция показателя отрицания,listed,J-9-3,Препозиция,В предложении допускается множественное отрицание.,,
K-1,Склонение личных местоимений,listed,K-1-3,Собственный тип склонения,,,
K-2,Типы артиклей,listed,K-2-1,Артикли отсутствуют,,,
K-3,Неопределенный артикль и числительное «один»,not_applicable,,,,,
K-4,Расположение артикля,not_applicable,,,,,
K-5,Постановка артикля в именной группе,not_applicable,,,,,
K-6,"Грамматические категории, выражаемые артиклем",not_applicable,,,,,
K-7,Количество типов спряжения глаголов,listed,K-7-2,Два типа спряжения,Существует группа разноспрягаемых глаголов.,,
K-8,Типы глагольного согласования,listed,K-8-2,Субъектное,,,
K-9,"Согласовательные категории, выражаемые причастием",listed,K-9-7,"Род, число и падеж",,,
K-10,"Время, выражаемое причастием",listed,K-10-6,Настоящее и прошедшее,,,
K-11,"Грамматические категории, выражаемые наречием",listed,K-11-2,Степени сравнения,,,
K-12,"Согласовательные категории, выражаемые прилагательным",listed,K-12-10,"Род, число и падеж",,,
K-13,Возможность кумулятивного выражения нескольких категорий в прилагательном,listed,K-13-7,"Рода, числа и падежа",,,
K-14,Атрибутивное согласование прилагательных,listed,K-14-1,Всегда присутствует,,,
K-15,Типы атрибутивного согласования,listed,K-15-2&K-15-3&K-15-4,По числу&По падежу&По роду,,,
K-16,"Изменяемые грамматические категории, выражаемые существительным",listed,K-16-7,Число и падеж,,,
K-17,Кумулятивное выражение нескольких категорий в существительном,listed,K-17-11,"Рода / согласовательного класса, числа и падежа",,,
K-18,Средства словоизменения,listed,K-18-10,"Внутренняя флексия, наращение/ усечение основы и аффиксы",,,
K-19,Модель словоформы,listed,K-19-1,Префиксально-суффиксальная,,,
L-1,Способы словообразования,listed,L-1-20,"Аффиксация, словосложение, конверсия и аббревиация",,,
L-2,"Аффиксы, участвующие в словообразовании",listed,L-2-17,"Префиксы, суффиксы, постфиксы и интерфиксы",,,
L-3,Отношения между соединяемыми основами при сложении основ,not_stated,,,,,
M-1,Стратегия кодирования глагольных актантов,listed,M-1-3,Аккузативная,,,
M-2,Фиксированность порядка слов,listed,M-2-2,Свободный,,,
M-3,Основной порядок слов в предложении,listed,M-3-1,SVO,,,
M-4,Порядок определения и определяемого,listed,M-4-3,Не фиксирован,,,
M-5,Опущение местоименного подлежащего в неэллиптических предложениях,listed,M-5-1,Возможно,,,
N-1,Линейный порядок компонентов в сложном предложении,listed,N-1-3,Не фиксирован,,,
N-2,Особенности подчиненного компонента в сложном предложении,not_stated,,,,,
N-3,Оформление сказуемого в придаточном предложении,listed,N-3-1,Финитные формы,,,
N-4,Тип построения сложного предложения,listed,N-4-4,Сочинение и подчинение,,,
N-5,Тип связи между элементами сложного предложения,custom,,"Союзная, бессоюзная и местоименная",,,
_aux,,not_applicable,,,А.К.Зотова / О.И.Романова,,
