feature_id,feature_name_ru,value_type,value_id,value_ru,comment_ru,comment_en,page_numbers
A-1,Количество степеней подъема гласных,custom,,Список из 9-10 гласных терминологически не интерпретируется,Вокализм в фонологическом аспекте не исследован.,,
A-2,Подъемы гласных,not_stated,,,,,
A-210,Противопоставление по открытости/закрытости в подъемах гласных,not_stated,,,,,
A-3,Ряды гласных,not_stated,,,,,
A-4,Фонологические ступени долготы,not_stated,,,,,
A-5,Противопоставление гласных по лабиализации,not_stated,,,,,
A-6,Противопоставление гласных по назализации,not_stated,,,,,
A-7,Противопоставление гласных по фарингализации,not_stated,,,,,
A-8,Противопоставление гласных по продвинутости корня языка,not_stated,,,,,
A-9,Наличие дифтонгов и трифтонгов,not_stated,,,,,
A-10,Типы дифтонгов,not_stated,,,,,
A-11,Инвентарь шумных согласных по ларингальным признакам,not_stated,,,"Выделяют 22 согласных, те же, что и в мазандеранском языке.",,
A-12,Инвентарь шумных согласных по способу артикуляции,not_stated,,,,,
A-13,Инвентарь шумных согласных по месту образования,not_stated,,,,,
A-14,Инвентарь шумных губных согласных по месту образования,not_stated,,,,,
A-15,Шумные переднеязычные согласные по месту образования,not_stated,,,,,
A-16,Шумные заднеязычные согласные по месту образования,not_stated,,,,,
A-17,Шумные постувулярные согласные по месту образования,not_stated,,,,,
A-18,Дополнительные артикуляционные противопоставления шумных согласных,not_stated,,,,,
A-19,Инвентарь сонорных согласных по способу артикуляции,not_stated,,,,,
A-20,Инвентарь сонорных согласных по месту образования,not_stated,,,,,
A-21,Дополнительные противопоставления сонорных согласных,not_stated,,,,,
A-220,Инвентарь фрикативных согласных по месту образования,not_stated,,,,,
B-1,Тип ударения,not_stated,,,,,
B-2,Вид ударения,not_stated,,,,,
B-3,Носитель ударения,not_stated,,,,,
B-4,Фиксированность ударения,not_stated,,,,,
B-5,Носитель фиксированного ударения в слове,not_stated,,,,,
B-6,Количество уровней тонов,not_stated,,,,,
B-7,Контурные признаки тона,not_stated,,,,,
B-8,Носитель тона,not_stated,,,,,
B-9,Характер долготы,not_stated,,,,,
B-10,Область гармонического уподобления гласных,not_stated,,,,,
B-11,Признак гармонического уподобления гласных,not_stated,,,,,
B-12,Уподобляющий элемент при гармоническом уподоблении гласных,not_stated,,,,,
B-13,Прочие супрасегментные явления,not_stated,,,,,
B-14,Типы фонации,not_stated,,,,,
C-1,Начальный согласный в слоге,not_stated,,,,,
C-2,Конечный согласный в слоге,not_stated,,,,,
D-1,Ограничения на фонемную структуру сегментных морфем в начальной позиции,not_stated,,,,,
D-2,Ограничения на фонемную структуру сегментных морфем в конечной позиции,not_stated,,,,,
D-3,Особенности слогового состава слова,not_stated,,,,,
D-4,Различия между знаменательными и служебными словами,not_stated,,,,,
D-5,Различия между исконными и заимствованными словами,not_stated,,,,,
D-6,Различия между корневыми и аффиксальными морфемами,not_stated,,,,,
D-7,Функциональный тип чередований,not_stated,,,,,
D-8,Вид чередований,not_stated,,,,,
E-1,Тип языка по способу соединения морфем в слове,listed,E-1-4,Флективный с элементами агглютинации,,,
E-2,Признаки флективного строя,not_stated,,,,,
E-3,Признаки агглютинативного строя,not_stated,,,,,
E-4,Тип языка по степени спаянности морфем,listed,E-4-3,Аналитический с элементами синтетизма,,,
F-1,Количество согласовательных классов,listed,F-1-1,Согласовательные классы отсутствуют,,,
F-2,Морфологические способы выражения согласовательных классов,not_applicable,,,,,
F-3,Синтаксические способы выражения согласовательных классов,not_applicable,,,,,
F-4,Другие способы выражения согласовательных классов,not_applicable,,,,,
F-5,Атрибутивное согласование по роду,not_stated,,,,,
F-6,Согласование количественных числительных в роде,not_stated,,,,,
F-7,Классифицирующие категории существительных,not_stated,,,,,
F-8,Противопоставление по личности/неличности,listed,F-8-1,Лексическое,,,
F-9,Способ выражения одушевленности/неодушевленности,not_stated,,,,,
G-1,Категория числа у существительных,listed,G-1-1,Единственное и множественное,,,
G-2,Маркирование единственного числа существительных,not_stated,,,,,
G-3,Формы вежливости в местоимениях и глаголах,not_stated,,,,,
G-4,Согласование по числу,listed,G-4-2,Предикативное,,,
G-5,Форма числа существительного в сочетании с числительными,listed,G-5-3,Единственное и множественное число,,,
G-6,Система счисления,not_stated,,,,,
G-7,"Неопределенный артикль и числительное ""один""",not_stated,,,,,
H-1,Количество падежей у имени существительного,listed,H-1-2,Три-семь,,,
H-2,Маркирование субъекта и объекта,listed,H-2-5,Глагольное согласование и падежные аффиксы,,,
H-3,Падежное оформление именного сказуемого,not_stated,,,,,
H-4,Падежное оформление посессивного отношения,listed,H-4-3,Генитив,,,
H-5,Другие способы оформления посессивного отношения,custom,,Изафетная конструкция,,,
H-6,Способ выражения пространственных отношений,custom,,"Локативные предлоги, вторичные отименные предлоги (безизафетные, изафетные и составные), послелоги и беспредложные глагольно-именные конструкции",,,
H-7,Маркирование зависимого имени в генитивной конструкции,not_stated,,,,,
H-8,Падежное оформление одушевленных и неодушевленных имен,not_stated,,,,,
H-9,Наличие вторичных падежей,not_stated,,,,,
I-1,Способ выражения залоговых форм в глаголе,custom,,Пассивный залог у личных форм глагола в имеющихся материалах не зафиксирован,,,
I-2,Возможность наложения нескольких залоговых форм,not_stated,,,,,
I-3,Двойные залоговые формы,not_stated,,,,,
I-4,Совпадение залоговых форм,not_stated,,,,,
I-5,Основные временные противопоставления,listed,I-5-6,Настоящее-будущее и прошедшее,,,
I-6,Выражение вида и времени,listed,I-6-2,Синкретическое,,,
I-7,Способ выражения временных категорий,custom,,"Личные окончания, аффиксы, вспомогательный глагол и причастие",,,
I-8,Синкретическое выражение нескольких глагольных значений,listed,I-8-17,"Лицо, число, время, вид и модальность (наклонение)",,,
I-9,Маркирование лица в глаголе в настоящем времени,listed,I-9-3,В единственном и множественном числе,,,
I-10,Маркер переходности,not_stated,,,,,
J-1,Наличие местоименных слов,listed,J-1-11,Местоимения-существительные и местоимения-прилагательные,,,
J-2,Способы выражения дейктических категорий,listed,J-2-16,"Указательные местоимения, предлоги и послелоги",,,
J-3,"Служебные части речи, выражающие пространственную ориентацию действия",listed,J-3-9,Предлоги и послелоги,,,
J-4,"Знаменательные части речи, выражающие пространственную ориентацию действия",listed,J-4-4,Местоимения,Других данных нет.,,
J-5,Морфологическое выражение определенности/неопределенности имени,listed,J-5-9,Различное оформление падежа у определенного и неопределенного объекта,,,
J-6,"Части речи, выражающие определенность/неопределенность имени",listed,J-6-21,"Артикли, местоимения и числительные",,,
J-7,Способы выражения форм вежливости,not_stated,,,,,
J-8,Способы выражения отрицания,not_stated,,,,,
J-9,Позиция показателя отрицания,not_stated,,,,,
K-1,Склонение личных местоимений,listed,K-1-3,Собственный тип склонения,,,
K-2,Типы артиклей,listed,K-2-4,Определенные и неопределенные,,,
K-3,Расположение артикля,listed,K-3-3,Препозиция и постпозиция,,,
K-4,Постановка артикля в именной группе,not_stated,,,,,
K-5,"Грамматические категории, выражаемые артиклем",listed,K-5-2,Определенность,Других данных нет.,,
K-6,Количество типов спряжения глаголов,listed,K-6-3,Три типа спряжения,,,
K-7,Типы глагольного согласования,not_stated,,,,,
K-8,"Согласовательные категории, выражаемые причастием",not_stated,,,,,
K-9,"Время, выражаемое причастием",listed,K-9-4,Прошедшее,,,
K-10,"Грамматические категории, выражаемые наречием",not_stated,,,,,
K-11,"Согласовательные категории, выражаемые прилагательным",listed,K-11-1,Отсутствуют,,,
K-12,Возможность кумулятивного выражения нескольких категорий в прилагательном,not_stated,,,,,
K-13,Атрибутивное согласование прилагательных,not_stated,,,,,
K-14,Типы атрибутивного согласования,not_stated,,,,,
K-15,"Изменяемые грамматические категории, выражаемые существительным",custom,,"Число, падеж и определенность/неопределенность",,,
K-16,Кумулятивное выражение нескольких категорий в существительном,listed,K-16-6,Числа и падежа,,,
K-17,Средства словоизменения,custom,,Именные суффиксы и личные окончания глагола,,,
K-18,Модель словоформы,listed,K-18-1,Префиксально-суффиксальная,,,
L-1,Способы словообразования,custom,,Суффиксация и сложение основ,,,
L-2,"Аффиксы, участвующие в словообразовании",listed,L-2-3,Префиксы и суффиксы,,,
L-3,Отношения между соединяемыми основами при сложении основ,not_stated,,,,,
M-1,Стратегия кодирования глагольных актантов,listed,M-1-7,Аккузативная с элементами эргативной,,,
M-2,Фиксированность порядка слов,not_stated,,,,,
M-3,Основной порядок слов в предложении,listed,M-3-2,SOV,В структуре простого предложения не имеет существенных отличий от мазандеранского языка.,,
M-4,Порядок определения и определяемого,not_stated,,,,,
M-5,Опущение местоименного подлежащего в неэллиптических предложениях,not_stated,,,,,
N-1,Линейный порядок компонентов в сложном предложении,not_stated,,,,,
N-2,Особенности подчиненного компонента в сложном предложении,not_stated,,,,,
N-3,Оформление сказуемого в придаточном предложении,not_stated,,,,,
N-4,Тип построения сложного предложения,listed,N-4-4,Сочинение и подчинение,В структуре сложного предложения не имеет существенных отличий от мазандеранского языка.,,
N-5,Тип связи между элементами сложного предложения,listed,N-5-3,Союзная и бессоюзная,,,
_aux,,not_applicable,,,А.К.Зотова,,
