feature_id,feature_name_ru,value_type,value_id,value_ru,comment_ru,comment_en,page_numbers
A-1,Количество степеней подъема гласных,custom,,Список из 18 гласных монофтонгов по количеству степеней подъема терминологически не интерпретируется,Фонологический статус гласных звукотипов не всегда ясен. Фонемный состав вокализма исследован слабо.,,
A-2,Подъемы гласных,custom,,Список из 18 гласных монофтонгов  по признаку подъема терминологически не интерпретируется,,,
A-210,Противопоставление по открытости/закрытости в подъемах гласных,not_stated,,,,,
A-3,Ряды гласных,listed,A-3-5,Передний и непередний,,,
A-4,Фонологические ступени долготы,listed,A-4-2,Две ступени,,,
A-5,Противопоставление гласных по лабиализации,not_stated,,,,,
A-6,Противопоставление гласных по назализации,custom,,Есть назализованные и неназализованные гласные,Фонологичекий статус назализованных гласных неясен.,,
A-7,Противопоставление гласных по фарингализации,not_stated,,,,,
A-8,Противопоставление гласных по продвинутости корня языка,not_stated,,,,,
A-9,Наличие дифтонгов и трифтонгов,listed,A-9-1,Дифтонги и трифтонги отсутствуют,Есть фонетические дифтонги [ou] и [ōu].,,
A-10,Типы дифтонгов,not_applicable,,,,,
A-11,Инвентарь шумных согласных по ларингальным признакам,listed,A-11-6,Противопоставления по звонкости/глухости и по аспирации,,,
A-12,Инвентарь шумных согласных по способу артикуляции,custom,,"Смычные, фрикативные и аффрикаты","Смычные: чистые и аффрикаты (одно- и двухфокусные), смычно-проходные (оральные и назальные) и щелевые (одно- и двухфокусные).",,
A-13,Инвентарь шумных согласных по месту образования,listed,A-13-2,"Лабиальные, переднеязычные, среднеязычные, заднеязычные и постувулярные",,,
A-14,Инвентарь шумных губных согласных по месту образования,listed,A-14-2,Билабиальные и лабиодентальные,,,
A-15,Шумные переднеязычные согласные по месту образования,custom,,Нецеребральные и церебральные,Различаются нецеребральные и церебральные смычные (чистые) и двухфокусные аффрикаты и фрикативные (шипящие).,,
A-16,Шумные заднеязычные согласные по месту образования,listed,A-16-5,Велярные и увулярные,Увулярные согласные встречаются в заимствованиях. Фрикативные образуют единый ряд заднеязычных.,,
A-17,Шумные постувулярные согласные по месту образования,listed,A-17-4,Только ларингальные,,,
A-18,Дополнительные артикуляционные противопоставления шумных согласных,listed,A-18-1,Отсутствуют,,,
A-19,Инвентарь сонорных согласных по способу артикуляции,listed,A-19-6,"Назальные, плавные, вибранты и глайды",Назальные и плавные классифицируются как смычно-проходные (назальные и оральные). Глайды /w/ и /y/ определяются как щелевые однофокусные. Среднеязычные и заднеязыные носовые встречаются в заимствованиях.,,
A-20,Инвентарь сонорных согласных по месту образования,listed,A-20-17,"Лабиальные, переднеязычные, среднеязычные и заднеязычные",Различаются нецеребральные и церебральные переднеязычные назальные и вибранты.,,
A-21,Дополнительные противопоставления сонорных согласных,listed,A-21-1,Отсутствуют,,,
A-220,Инвентарь фрикативных согласных по месту образования,custom,,"Лабиальные, переднеязычные, среднеязычные, заднеязычные и ларингальные",Велярные и увулярные заднеязычные образуют единый ряд. Классификация отражает таблицу консонантизма в статье.,,
B-1,Тип ударения,listed,B-1-2,Фонологическое,,,
B-2,Вид ударения,listed,B-2-1,Динамическое,,,
B-3,Носитель ударения,listed,B-3-1,Слог,,,
B-4,Фиксированность ударения,custom,,Неподвижное фиксированное,,,
B-5,Носитель фиксированного ударения в слове,custom,,Корень или аффикс,,,
B-6,Количество уровней тонов,listed,B-6-1,Два,,,
B-7,Контурные признаки тона,custom,,Ровный и низкий-восходящий,,,
B-8,Носитель тона,not_stated,,,,,
B-9,Характер долготы,listed,B-9-4,Фонологическая и нефонологическая,,,
B-10,Область гармонического уподобления гласных,not_stated,,,,,
B-11,Признак гармонического уподобления гласных,not_applicable,,,,,
B-12,Уподобляющий элемент при гармоническом уподоблении гласных,not_applicable,,,,,
B-13,Прочие супрасегментные явления,custom,,"Зашумление, редукция и падение конечных гласных, назализация, палатализация, лабиализация, аспирация, оглушение и озвончение согласных, протеза глайдов для устранения зияния",,,
B-14,Типы фонации,not_stated,,,,,
C-1,Начальный согласный в слоге,explicit_gap,,,Строение слога не изучено.,,
C-2,Конечный согласный в слоге,explicit_gap,,,,,
D-1,Ограничения на фонемную структуру сегментных морфем в начальной позиции,not_stated,,,,,
D-2,Ограничения на фонемную структуру сегментных морфем в конечной позиции,not_stated,,,,,
D-3,Особенности слогового состава слова,not_stated,,,,,
D-4,Различия между знаменательными и служебными словами,not_stated,,,,,
D-5,Различия между исконными и заимствованными словами,listed,D-5-2,Различия в фонетическом составе,,,
D-6,Различия между корневыми и аффиксальными морфемами,custom,,Различия в фонетическом составе и тоновые различия,,,
D-7,Функциональный тип чередований,listed,D-7-3,Смыслоразличительные,,,
D-8,Вид чередований,listed,D-8-12,Вокалические и тоновые,,,
E-1,Тип языка по способу соединения морфем в слове,listed,E-1-3,Флективный,,,
E-2,Признаки флективного строя,custom,,Кумулятивность флексий и наличие параллельных типов словоизменения,,,
E-3,Признаки агглютинативного строя,not_stated,,,,,
E-4,Тип языка по степени спаянности морфем,listed,E-4-6,Синтетический с элементами аналитизма,,,
F-1,Количество согласовательных классов,listed,F-1-2,Два,Различаются мужской и женский род.,,
F-2,Морфологические способы выражения согласовательных классов,custom,,"Аффиксы в имени и флексии в прилагательном, числительном, местоимении и глаголе",,,
F-3,Синтаксические способы выражения согласовательных классов,listed,F-3-11,"В прилагательном, числительном, местоимении и глаголе",Глагол различает род только в формах единственного числа.,,
F-4,Другие способы выражения согласовательных классов,not_stated,,,,,
F-5,Атрибутивное согласование по роду,listed,F-5-2,В единственном и множественном числе,,,
F-6,Согласование количественных числительных в роде,listed,F-6-3,"Для числительного ""один""",,,
F-7,Классифицирующие категории существительных,not_stated,,,,,
F-8,Противопоставление по личности/неличности,listed,F-8-1,Лексическое,,,
F-9,Способ выражения одушевленности/неодушевленности,listed,F-9-1,Лексический,,,
G-1,Категория числа у существительных,listed,G-1-1,Единственное и множественное,,,
G-2,Маркирование единственного числа существительных,listed,G-2-2,Немаркированное,,,
G-3,Формы вежливости в местоимениях и глаголах,not_stated,,,,,
G-4,Согласование по числу,listed,G-4-4,Предикативное и атрибутивное,,,
G-5,Форма числа существительного в сочетании с числительными,listed,G-5-3,Единственное и множественное,,,
G-6,Система счисления,listed,G-6-6,Двадцатеричная,,,
G-7,"Неопределенный артикль и числительное «один»",not_applicable,,,,,
H-1,Количество падежей у имени существительного,listed,H-1-1,Один-два,,,
H-2,Маркирование субъекта и объекта,custom,,"Падежные флексии, послелоги, глагольное согласование и порядок слов",,,
H-3,Падежное оформление именного сказуемого,not_stated,,,,,
H-4,Падежное оформление посессивного отношения в именной группе,listed,H-4-5,Косвенный,,,
H-5,Другие способы оформления посессивного отношения,custom,,Личные и притяжательные местоимения и послелоги,,,
H-6,Способ выражения пространственных отношений,custom,,"Падежные флексии, указательные местоимения и послелоги ",Пространственные отношения выражаются послелогами в сочетании с формой косвенного падежа существительного.,,
H-7,Маркирование в посессивной конструкции,custom,,Генитив отсутствует,,,
H-8,Падежное оформление одушевленных и неодушевленных имен существительных,not_stated,,,,,
H-9,Наличие вторичных падежей,not_stated,,,,,
I-1,Способ выражения залоговых форм в глаголе,listed,I-1-4,Аффиксы,,,
I-2,Возможность наложения нескольких залоговых форм,not_stated,,,,,
I-3,Двойные залоговые формы,not_stated,,,,,
I-4,Совпадение залоговых форм,not_stated,,,,,
I-5,Грамматические формы времени,listed,I-5-1&I-5-2&I-5-3&I-5-5,Прошедшее&Настоящее&Будущее&Непрошедшее (настоящее-будущее),,,
I-6,Выражение вида и времени,listed,I-6-2,Синкретическое,,,
I-7,Способ выражения временных категорий,custom,,"Причастие, вспомогательный глагол, аффиксы, флексии и частицы",,,
I-8,Синкретическое выражение нескольких глагольных значений,listed,I-8-19,"Лицо, число, род, время, вид и модальность (наклонение)",,,
I-9,Маркирование лица в глаголе в настоящем времени,listed,I-9-3,В единственном и множественном числе,,,
I-10,Маркер переходности,custom,,"Аффикс, особый тип согласования и послелоги",,,
J-1,Наличие местоименных слов,listed,J-1-11,Местоимения-существительные и местоимения-прилагательные,,,
J-2,Способы выражения дейктических категорий,listed,J-2-17,"Указательные местоимения, послелоги и наречия",,,
J-3,"Служебные части речи, выражающие пространственную ориентацию действия",listed,J-3-2,Послелоги,,,
J-4,"Знаменательные части речи, выражающие пространственную ориентацию действия",listed,J-4-6,Местоимения и наречия,,,
J-5,Морфологическое выражение определенности/неопределенности имени,listed,J-5-10,Различное падежное оформление определенного и неопределенного объекта,Категория определенности/неопределенности существительных прослежена слабо. ,,
J-6,"Части речи, выражающие определенность/неопределенность имени",listed,J-6-16,Числительные и местоимения,,,
J-7,Способы выражения форм вежливости,not_stated,,,,,
J-8,Способы выражения отрицания,custom,,"Отрицательные частицы, глаголы и аффиксы",,,
J-9,Позиция показателя отрицания,listed,J-9-3,Препозиция,,,
K-1,Склонение личных местоимений,listed,K-1-3,Собственный тип склонения,,,
K-2,Типы артиклей,listed,K-2-1,Артикли отсутствуют,,,
K-3,Расположение артикля,not_applicable,,,,,
K-4,Постановка артикля в именной группе,not_applicable,,,,,
K-5,"Грамматические категории, выражаемые артиклем",not_applicable,,,,,
K-7,Количество типов спряжения глаголов,listed,K-7-2,Два типа спряжения,,,
K-8,Типы глагольного согласования,listed,K-8-2,Субъектное,,,
K-9,"Согласовательные категории, выражаемые причастием",not_stated,,,,,
K-10,"Время, выражаемое причастием",listed,K-10-4,Прошедшее,,,
K-11,"Грамматические категории, выражаемые наречием",listed,K-11-1,Отсутствуют,,,
K-12,"Согласовательные категории, выражаемые прилагательным",listed,K-12-7,Род и число,,,
K-13,Возможность кумулятивного выражения нескольких категорий в прилагательном,listed,K-13-5,Рода и числа,,,
K-14,Атрибутивное согласование прилагательных,not_stated,,,,,
K-15,Типы атрибутивного согласования,listed,K-15-4&K-15-2,По роду&По числу,Есть изменяемые и неизменяемые прилагательные.,,
K-16,"Изменяемые грамматические категории, выражаемые существительным",custom,,Число и падеж,,,
K-17,Кумулятивное выражение нескольких категорий в существительном,custom,,"Рода, числа и падежа",,,
K-18,Средства словоизменения,custom,,"Флексии, аффиксы, послелоги и частицы",,,
K-19,Модель словоформы,listed,K-19-4,Преимущественно или только суффиксальная,,,
L-1,Способы словообразования,custom,,"Аффиксация, словосложение и конверсия",,,
L-2,"Аффиксы, участвующие в словообразовании",listed,L-2-3,Префиксы и суффиксы,,,
L-3,Отношения между соединяемыми основами при сложении основ,not_stated,,,,,
M-1,Стратегия кодирования глагольных актантов,listed,M-1-7,Аккузативная с элементами эргативной,,,
M-2,Фиксированность порядка слов,not_stated,,,,,
M-3,Основной порядок слов в предложении,listed,M-3-2,SOV,,,
M-4,Порядок определения и определяемого,listed,M-4-1,Определение предшествует определяемому,,,
M-5,Опущение местоименного подлежащего в неэллиптических предложениях,not_stated,,,,,
N-1,Линейный порядок компонентов в сложном предложении,not_stated,,,,,
N-2,Особенности подчиненного компонента в сложном предложении,not_stated,,,,,
N-3,Оформление сказуемого в придаточном предложении,listed,N-3-3,Финитные и нефинитные формы,,,
N-4,Тип построения сложного предложения,listed,N-4-2,Подчинение,В статье упоминаются только сложноподчиненные предложения.,,
N-5,Тип связи между элементами сложного предложения,listed,N-5-3,Союзная и бессоюзная,,,
_aux,,not_applicable,,,А.К.Зотова/О.И.Романова,,
