feature_id,feature_name_ru,value_type,value_id,value_ru,comment_ru,comment_en
A-1,Количество степеней подъема,listed,A-1-1,Две,,
A-2,Подъемы гласных,listed,A-2-1,Верхний и нижний,,
A-210,Противопоставление по открытости/закрытости в подъемах гласных,not_stated,,,,
A-3,Ряды гласных,listed,A-3-2,Передний и задний,,
A-4,Фонологические ступени долготы,listed,A-4-2,Две ступени,,
A-5,Противопоставление гласных по лабиализации,not_stated,,,,
A-6,Противопоставление гласных по назализации,not_stated,,,,
A-7,Противопоставление гласных по фарингализации,not_stated,,,,
A-8,Противопоставление гласных по продвинутости корня языка,not_stated,,,,
A-9,Наличие дифтонгов и трифтонгов,not_stated,,,,
A-10,Типы дифтонгов,not_stated,,,,
A-11,Инвентарь шумных согласных по ларингальным признакам,listed,A-11-2,Есть противопоставления по аспирации,,
A-12,Инвентарь шумных согласных по способу артикуляции,listed,A-12-3,"Взрывные, фрикативные и аффрикаты",,
A-13,Инвентарь шумных согласных по месту образования,listed,A-13-2,"Лабиальные, переднеязычные, среднеязычные, заднеязычные и постувулярные",,
A-14,Инвентарь шумных губных согласных по месту образования,listed,A-14-1,Только билабиальные,,
A-15,Шумные переднеязычные согласные по месту образования,listed,A-15-6,Дентальные и альвеолярные,,
A-16,Шумные заднеязычные согласные по месту образования,listed,A-16-1,Велярные,,
A-17,Шумные постувулярные согласные по месту образования,listed,A-17-2,Только глоттальные,,
A-18,Дополнительные артикуляционные противопоставления шумных согласных,not_stated,,,,
A-19,Инвентарь сонорных согласных по способу артикуляции,listed,A-19-6,"Назальные, плавные, вибранты и глайды",,
A-20,Инвентарь сонорных согласных по месту образования,listed,A-20-17,"Лабиальные, переднеязычные, среднеязычные и заднеязычные",,
A-21,Дополнительные противопоставления сонорных согласных,listed,A-21-1,Отсутствуют,,
B-1,Тип ударения,not_stated,,,,
B-2,Вид ударения,not_stated,,,,
B-3,Носитель ударения,not_stated,,,,
B-4,Фиксированность ударения,not_stated,,,,
B-5,Носитель фиксированного ударения в слове,not_stated,,,,
B-6,Количество уровней тонов,not_stated,,,,
B-7,Контурные признаки тона,not_stated,,,,
B-8,Носитель тона,not_stated,,,,
B-9,Характер долготы,not_stated,,,,
B-10,Область гармонического уподобления гласных,listed,B-10-3,Аффикс,,
B-11,Признак гармонического уподобления гласных,listed,B-11-3,Подъем,,
B-12,Уподобляющий элемент при гармоническом уподоблении гласных,listed,B-12-3,Первый гласный корня,,
B-13,Прочие супрасегментные явления,not_stated,,,,
B-14,Типы фонации,not_stated,,,,
C-1,Начальный согласный в слоге,not_stated,,,,
C-2,Конечный согласный в слоге,not_stated,,,,
D-1,Ограничения на фонемную структуру сегментных морфем в начальной позиции,not_stated,,,,
D-2,Ограничения на фонемную структуру сегментных морфем в конечной позиции,not_stated,,,,
D-3,Особенности слогового состава слова,not_stated,,,,
D-4,Различия между знаменательными и служебными словами,not_stated,,,,
D-5,Различия между исконными и заимствованными словами,not_stated,,,,
D-6,Различия между корневыми и аффиксальными морфемами,not_stated,,,,
D-7,Функциональный тип чередований,not_stated,,,,
D-8,Вид чередований,not_stated,,,,
E-1,Тип языка по способу соединения морфем в слове,listed,E-1-2,Агглютинативный с элементами флективного,,
E-2,Признаки флективного строя,not_stated,,,,
E-3,Признаки агглютинативного строя,not_stated,,,,
E-4,Тип языка по степени спаянности морфем,listed,E-4-5,Синтетический,,
F-1,Количество согласовательных классов,listed,F-1-1,Согласовательные классы отсутствуют,,
F-2,Морфологические способы выражения согласовательных классов,not_stated,,,,
F-3,Синтаксические способы выражения согласовательных классов,not_stated,,,,
F-4,Другие способы выражения согласовательных классов,not_stated,,,,
F-5,Атрибутивное согласование по роду,not_stated,,,,
F-6,Согласование количественных числительных в роде,not_stated,,,,
F-7,Классифицирующие категории существительных,listed,F-7-3,Одушевленность/неодушевленность,,
F-8,Противопоставление по личности/ неличности,not_stated,,,,
F-9,Способ выражения одушествленности/ неодушевленности,listed,F-9-6,Лексический и морфологический,,
G-1,Структура числа,listed,G-1-1,Единственное и множественное,,
G-2,Маркирование единственного числа,not_stated,,,,
G-3,Гонорифические формы числа,not_stated,,,,
G-4,Согласование по числу,listed,G-4-2,Предикативное,,
G-5,Форма имен после числительного,not_stated,,,,
G-6,Система счисления,not_stated,,,,
G-7,"Неопределенный артикль и числительное ""один""",listed,G-7-1,Неопределенный артикль отсутствует,,
H-1,Количество падежей,listed,H-1-3,Восемь-двенадцать,,
H-2,Маркирование субъекта и объекта,not_stated,,,,
H-3,Падежное оформление именного сказуемого,not_stated,,,,
H-4,Падежное оформление посессивного отношения,listed,H-4-3,Генитив,,
H-5,Другие способы оформления посессивного отношения,listed,H-5-4,Посессивные местоимения,,
H-6,Способ выражения пространственных отношений,listed,H-6-8,Именные аффиксы и глагольные аффиксы,,
H-7,Маркирование зависимостного имени в генетивной конструкции,not_stated,,,,
H-8,Падежное оформление одушевленных и неодушевленных имен,listed,H-8-1,Одинаковое,,
H-9,Наличие вторичных падежей,not_stated,,,,
I-1,Способ выражения залоговых форм в глаголе,listed,I-1-1,Категория залога отсутствует,,
I-2,Возможность наложения нескольких залоговых форм,not_stated,,,,
I-3,Двойные залоговые формы,not_stated,,,,
I-4,Совпадение залоговых форм,not_stated,,,,
I-5,Основные временные противопоставления,listed,I-5-1,Отсутствуют,,
I-6,Выражение вида и времени,not_stated,,,,
I-7,Способ выражения временных категорий,not_stated,,,,
I-8,Синкретическое выражение нескольких глагольных значений,listed,I-8-1,Отсутствует,,
I-9,Маркирование лица в глаголе в настоящем времени,not_stated,,,,
I-10,Маркер переходности,listed,I-10-1,Отсутствует,,
J-1,Наличие местоименных слов,not_stated,,,,
J-2,Способы выражения дейктических категорий,not_stated,,,,
J-3,"Служебные части речи, выражающие пространственную ориентацию действия",not_stated,,,,
J-4,"Знаменательные части речи, выражающие пространственную ориентацию действия",not_stated,,,,
J-5,Морфологическое выражение определенности/неопределенности имени,not_stated,,,,
J-6,"Части речи, выражающие определенность-неопределенность имени",not_stated,,,,
J-7,Способы выражения форм вежливости,not_stated,,,,
J-8,Способы выражения отрицания,listed,J-8-1,Отрицательные аффиксы,,
J-9,Позиция показателя отрицания,listed,J-9-3,Препозиция,,
K-1,Склонение личных местоимений,not_stated,,,,
K-2,Типы артиклей,listed,K-2-1,Артикли отсутствуют,,
K-3,Расположение артикля,not_stated,,,,
K-4,Постановка артикля в именной группе,not_stated,,,,
K-5,"Грамматические категории, выражаемые артиклем",not_stated,,,,
K-6,Количество типов спряжения глаголов,not_stated,,,,
K-7,Типы глагольного согласования,listed,K-7-4,Субъектное и субъектно-объектное,,
K-8,"Согласовательные категории, выражаемые причастием",not_stated,,,,
K-9,"Время, выражаемое причастием",not_stated,,,,
K-10,"Грамматические категории, выражаемые наречием",not_stated,,,,
K-11,"Согласовательные категории, выражаемые прилагательным",not_stated,,,,
K-12,Возможность кумулятивного выражения нескольких категорий в прилагательном,not_stated,,,,
K-13,Атрибутивное согласование прилагательных,not_stated,,,,
K-14,Типы атрибутивного согласования,listed,K-14-1,Атрибутивное согласование отсутствует,,
K-15,"Изменяемые грамматические категории, выражаемые существительным",listed,K-15-7,Падеж и число,,
K-16,Кумулятивное выражение нескольких категорий в существительном,listed,K-16-1,Отсутствует,,
K-17,Средства словоизменения,listed,K-17-2,Аффиксы,,
K-18,Модель словоформы,listed,K-18-1,Префиксально-суффиксальная,,
L-1,Способы словообразования,listed,L-1-18,"Конверсия, словосложение и аффиксация",,
L-2,"Аффиксы, участвующие в словообразовании",listed,L-2-3,Префиксы и суффиксы,,
L-3,Отношения между соединяемыми основами при сложении основ,listed,L-3-5,Аппозиция и подчинение,,
M-1,Стратегия кодирования глагольных актантов,listed,M-1-5,Эргативная,,
M-2,Фиксированность порядка слов,not_stated,,,,
M-3,Основной порядок слов в предложении,listed,M-3-2,SOV,,
M-4,Порядок определения и определяемого,listed,M-4-2,Определение следует за определямым,,
M-5,Опущение местоименного подлежащего в неэллиптических предложениях,listed,M-5-1,Возможно,,
N-1,Линейный порядок компонентов в сложном предложении,not_stated,,,,
N-2,Особенности подчиненного компонента в сложном предложении,not_stated,,,,
N-3,Оформления сказуемого в придаточном предложении,not_stated,,,,
N-4,Тип построения сложного предложения,listed,N-4-4,Сочинение и подчинение,,
N-5,Тип связи между элементами сложного предложения,listed,N-5-3,Союзная и бессоюзная,,
