feature_id,feature_name_ru,value_type,value_id,value_ru,comment_ru,comment_en,page_numbers
A-1,Количество степеней подъема гласных,custom,,"Списки, включающие по разным источникам от 9 до 14 гласных, терминологически не интерпретируются",Группа языков/диалектов Центрального Ирана.,,
A-2,Подъемы гласных,not_stated,,,,,
A-210,Противопоставление по открытости/закрытости в подъемах гласных,not_stated,,,,,
A-3,Ряды гласных,custom,,Гласные по признаку ряда терминологически не интерпретируются,,,
A-4,Фонологические ступени долготы,custom,,Две ступени долготы гласных фонологически не интерпретируются,,,
A-5,Противопоставление гласных по лабиализации,listed,A-5-11,Во всех рядах,Других данных нет.,,
A-6,Противопоставление гласных по назализации,not_stated,,,,,
A-7,Противопоставление гласных по фарингализации,not_stated,,,,,
A-8,Противопоставление гласных по продвинутости корня языка,not_stated,,,,,
A-9,Наличие дифтонгов и трифтонгов,listed,A-9-1,Дифтонги и трифтонги отсутствуют,Других данных нет.,,
A-10,Типы дифтонгов,not_applicable,,,,,
A-11,Инвентарь шумных согласных по ларингальным признакам,listed,A-11-1,Противопоставление по звонкости/глухости,,,
A-12,Инвентарь шумных согласных по способу артикуляции,custom,,"Смычные, аффрикаты, щелевые (одно- и двухфокусные)",,,
A-13,Инвентарь шумных согласных по месту образования,listed,A-13-3,"Лабиальные, переднеязычные, среднеязычные и заднеязычные",,,
A-14,Инвентарь шумных губных согласных по месту образования,listed,A-14-2,Билабиальные и лабиодентальные,,,
A-15,Шумные переднеязычные согласные по месту образования,not_stated,,,,,
A-16,Шумные заднеязычные согласные по месту образования,listed,A-16-5,Велярные и увулярные,,,
A-17,Шумные постувулярные согласные по месту образования,not_stated,,,,,
A-18,Дополнительные артикуляционные противопоставления шумных согласных,not_stated,,,,,
A-19,Инвентарь сонорных согласных по способу артикуляции,listed,A-19-2,"Назальные, плавные и вибранты",,,
A-20,Инвентарь сонорных согласных по месту образования,listed,A-20-14,"Лабиальные, переднеязычные и среднеязычные",Других данных нет.,,
A-21,Дополнительные противопоставления сонорных согласных,listed,A-21-3,По палатализации,Других данных нет.,,
A-220,Инвентарь фрикативных согласных по месту образования,not_stated,,,,,
B-1,Тип ударения,listed,B-1-3,Нефонологическое,Вопросы ударения в языках/диалектах Центрального Ирана не изучены.,,
B-2,Вид ударения,listed,B-2-1,Динамическое,,,
B-3,Носитель ударения,listed,B-3-1,Слог,,,
B-4,Фиксированность ударения,listed,B-4-3,Разноместно фиксированное,,,
B-5,Носитель фиксированного ударения в слове,custom,,"Префиксы или последний слог, кроме постпозтивных элементов: изафетного показателя, показателя неопределенности/единичности и энклитических местоимений",,,
B-6,Количество уровней тонов,not_stated,,,,,
B-7,Контурные признаки тона,not_stated,,,,,
B-8,Носитель тона,not_stated,,,,,
B-9,Характер долготы,custom,,Вопрос о фонологической значимости долготы гласных остается открытым,,,
B-10,Область гармонического уподобления гласных,not_stated,,,,,
B-11,Признак гармонического уподобления гласных,not_stated,,,,,
B-12,Уподобляющий элемент при гармоническом уподоблении гласных,not_stated,,,,,
B-13,Прочие супрасегментные явления,not_stated,,,,,
B-14,Типы фонации,not_stated,,,,,
C-1,Начальный согласный в слоге,listed,C-1-5,Есть прикрытые и неприкрытые слоги,,,
C-2,Конечный согласный в слоге,listed,C-2-5,Есть закрытые и открытые слоги,,,
D-1,Ограничения на фонемную структуру сегментных морфем в начальной позиции,listed,D-1-6,Запрет на любые стечения согласных,,,
D-2,Ограничения на фонемную структуру сегментных морфем в конечной позиции,not_stated,,,,,
D-3,Особенности слогового состава слова,not_stated,,,,,
D-4,Различия между знаменательными и служебными словами,listed,D-4-3,Акцентные различия,,,
D-5,Различия между исконными и заимствованными словами,listed,D-5-2,Различия в фонетическом составе,,,
D-6,Различия между корневыми и аффиксальными морфемами,listed,D-6-3,Акцентные различия,,,
D-7,Функциональный тип чередований,not_stated,,,,,
D-8,Вид чередований,not_stated,,,,,
E-1,Тип языка по способу соединения морфем в слове,listed,E-1-3,Флективный,,,
E-2,Признаки флективного строя,listed,E-2-2,Кумулятивность аффиксов,,,
E-3,Признаки агглютинативного строя,not_stated,,,,,
E-4,Тип языка по степени спаянности морфем,listed,E-4-6,Синтетический с элементами аналитизма,,,
F-1,Количество согласовательных классов,listed,F-1-1,Согласовательные классы отсутствуют,,,
F-2,Морфологические способы выражения согласовательных классов,not_applicable,,,,,
F-3,Синтаксические способы выражения согласовательных классов,not_applicable,,,,,
F-4,Другие способы выражения согласовательных классов,not_applicable,,,,,
F-5,Атрибутивное согласование по роду,not_stated,,,,,
F-6,Согласование количественных числительных в роде,not_stated,,,,,
F-7,Классифицирующие категории существительных,not_stated,,,,,
F-8,Противопоставление по личности/неличности,not_stated,,,,,
F-9,Способ выражения одушевленности/неодушевленности,listed,F-9-1,Лексический,,,
G-1,Категория числа у существительных,listed,G-1-1,Единственное и множественное,,,
G-2,Маркирование единственного числа существительных,not_stated,,,,,
G-3,Формы вежливости в местоимениях и глаголах,not_stated,,,,,
G-4,Согласование по числу,listed,G-4-2,Предикативное,,,
G-5,Форма числа существительного в сочетании с числительными,listed,G-5-3,Единственное и множественное число,,,
G-6,Система счисления,listed,G-6-1,Десятичная,Других данных нет.,,
G-7,"Неопределенный артикль и числительное ""один""",custom,,"Препозитвный неопределенный артикль, выраженный числительным ""один"" и постпозитивный энклитический показатель непределенности/единичности",,,
H-1,Количество падежей у имени существительного,not_stated,,,,,
H-2,Маркирование субъекта и объекта,custom,,"Глагольное согласование, позиция слова в предложении, предлоги и послелоги",,,
H-3,Падежное оформление именного сказуемого,not_stated,,,,,
H-4,Падежное оформление посессивного отношения в именной группе,not_stated,,,,,
H-5,Другие способы оформления посессивного отношения,custom,,"Изафетная конструкция, местоименные энклитики и порядок слов",,,
H-6,Способ выражения пространственных отношений,custom,,"Указательные местоимения, наречия места, предлоги, в том числе изафетные и вторичные/отыменные, и полелоги",,,
H-7,Локус маркирования в посессивной конструкции,not_stated,,,,,
H-8,Падежное оформление одушевленных и неодушевленных имен существительных,not_stated,,,,,
H-9,Наличие вторичных падежей,not_stated,,,,,
I-1,Способ выражения залоговых форм в глаголе,listed,I-1-1,Категория залога отсутствует,Залоговые противопоставления фрмально не выражены.,,
I-2,Возможность наложения нескольких залоговых форм,not_applicable,,,,,
I-3,Двойные залоговые формы,not_applicable,,,,,
I-4,Совпадение залоговых форм,not_applicable,,,,,
I-5,Основные временные противопоставления,listed,I-5-6,Настоящее-будущее и прошедшее,,,
I-6,Выражение вида и времени,listed,I-6-2,Синкретическое,,,
I-7,Способ выражения временных категорий,custom,,"Тип основы, личные окончания, префиксы, отделенные показатели лица и числа, энклитические местоимения, причастие + глагол связка/вспомогательный глагол",,,
I-8,Синкретическое выражение нескольких глагольных значений,listed,I-8-17,"Лицо, число, время, вид и модальность (наклонение)",,,
I-9,Маркирование лица в глаголе в настоящем времени,listed,I-9-3,В единственном и множественном числе,,,
I-10,Маркер переходности,listed,I-10-6,Изменение типа спряжения,,,
J-1,Наличие местоименных слов,listed,J-1-11,Местоимения-существительные и местоимения-прилагательные,,,
J-2,Способы выражения дейктических категорий,listed,J-2-12,Указательные местоимения и артикли,,,
J-3,"Служебные части речи, выражающие пространственную ориентацию действия",listed,J-3-9,Предлоги и послелоги,,,
J-4,"Знаменательные части речи, выражающие пространственную ориентацию действия",listed,J-4-6,Местоимения и наречия,,,
J-5,Морфологическое выражение определенности/неопределенности имени,listed,J-5-1,Отсутствует,Других данных нет.,,
J-6,"Части речи, выражающие определенность/неопределенность имени",listed,J-6-15,Артикли и числительные,,,
J-7,Способы выражения форм вежливости,not_stated,,,,,
J-8,Способы выражения отрицания,custom,,Отрицательные местоимения и глагольные префиксы,Других данных нет.,,
J-9,Позиция показателя отрицания,listed,J-9-3,Препозиция,,,
K-1,Склонение личных местоимений,listed,K-1-3,Собственный тип склонения,,,
K-2,Типы артиклей,listed,K-2-2,Только неопределенные,,,
K-3,Расположение артикля,listed,K-3-3,Препозиция и постпозиция,,,
K-4,Постановка артикля в именной группе,listed,K-4-1,Единый артикль для всей именной группы,,,
K-5,"Грамматические категории, выражаемые артиклем",custom,,Неопределенность/единичность,,,
K-6,Количество типов спряжения глаголов,listed,K-6-2,Два типа спряжения,,,
K-7,Типы глагольного согласования,listed,K-7-2,Субъектное,,,
K-8,"Согласовательные категории, выражаемые причастием",listed,K-8-1,Отсутствуют,Других данных нет.,,
K-9,"Время, выражаемое причастием",listed,K-9-4,Прошедшее,,,
K-10,"Грамматические категории, выражаемые наречием",listed,K-10-1,Отсутствуют,,,
K-11,"Согласовательные категории, выражаемые прилагательным",listed,K-11-1,Отсутствуют,Других данных нет.,,
K-12,Возможность кумулятивного выражения нескольких категорий в прилагательном,not_stated,,,,,
K-13,Атрибутивное согласование прилагательных,not_stated,,,,,
K-14,Типы атрибутивного согласования,not_stated,,,,,
K-15,"Изменяемые грамматические категории, выражаемые существительным",custom,,Неопределенность и число,,,
K-16,Кумулятивное выражение нескольких категорий в существительном,custom,,Неопределенности и числа,,,
K-17,Средства словоизменения,listed,K-17-2,Аффиксы,,,
K-18,Модель словоформы,listed,K-18-1,Префиксально-суффиксальная,,,
L-1,Способы словообразования,listed,L-1-24,Аффиксация и конверсия,Других данных нет.,,
L-2,"Аффиксы, участвующие в словообразовании",listed,L-2-3,Префиксы и суффиксы,,,
L-3,Отношения между соединяемыми основами при сложении основ,not_stated,,,,,
M-1,Стратегия кодирования глагольных актантов,listed,M-1-2,Нейтральная,,,
M-2,Фиксированность порядка слов,not_stated,,,,,
M-3,Основной порядок слов в предложении,listed,M-3-2,SOV,Других данных нет.,,
M-4,Порядок определения и определяемого,listed,M-4-2,Определение следует за определяемым,,,
M-5,Опущение местоименного подлежащего в неэллиптических предложениях,not_stated,,,,,
N-1,Линейный порядок компонентов в сложном предложении,not_stated,,,,,
N-2,Особенности подчиненного компонента в сложном предложении,not_stated,,,,,
N-3,Оформление сказуемого в придаточном предложении,not_stated,,,,,
N-4,Тип построения сложного предложения,listed,N-4-4,Сочинение и подчинение,,,
N-5,Тип связи между элементами сложного предложения,listed,N-5-3,Союзная и бессоюзная,,,
_aux,,not_applicable,,,А.К.Зотова,,
