feature_id,feature_name_ru,value_type,value_id,value_ru,comment_ru,comment_en,page_numbers
A-1,Количество степеней подъема гласных,custom,,Список из восьми гласных фонем по количеству степеней подъема терминологически не интерпретируется,Бесписьменный язык. Генетически близок к языку ашкун.,,
A-2,Подъемы гласных,custom,,Список из восьми гласных фонем по признаку подъема терминологически не интерпретируется,,,
A-210,Противопоставление по открытости/закрытости в подъемах гласных,not_stated,,,,,
A-3,Ряды гласных,custom,,Список из восьми гласных фонем по признаку ряда терминологически не интерпретируется,,,
A-4,Фонологические ступени долготы,not_stated,,,,,
A-5,Противопоставление гласных по лабиализации,not_stated,,,,,
A-6,Противопоставление гласных по назализации,custom,,Есть назализованные и неназализованные гласные,"Предположительно, назализация фонологически релевантна.",,
A-7,Противопоставление гласных по фарингализации,not_stated,,,,,
A-8,Противопоставление гласных по продвинутости корня языка,not_stated,,,,,
A-9,Наличие дифтонгов и трифтонгов,not_stated,,,,,
A-10,Типы дифтонгов,not_applicable,,,,,
A-11,Инвентарь шумных согласных по ларингальным признакам,listed,A-11-1,Противопоставление по звонкости/глухости,,,
A-12,Инвентарь шумных согласных по способу артикуляции,custom,,"Смычные, фрикативные и аффрикаты ","Смычные: чистые (неносовые и носовые) и аффрикаты (одно- и двухфокусные), и щелевые: срединные (одно- и двухфокусные) и боковые. ",,
A-13,Инвентарь шумных согласных по месту образования,listed,A-13-3,"Лабиальные, переднеязычные, среднеязычные и заднеязычные",,,
A-14,Инвентарь шумных губных согласных по месту образования,listed,A-14-2,Билабиальные и лабиодентальные,Глухой лабиодентальный встречается в заимствованиях.,,
A-15,Шумные переднеязычные согласные по месту образования,custom,,Нецеребральные и церебральные,"Различаются нецеребральные и церебральные смычные (чистые), двухфокусные аффрикаты и фрикативные.",,
A-16,Шумные заднеязычные согласные по месту образования,listed,A-16-5,Велярные и увулярные,Увулярные встречаются в заимствованиях.,,
A-17,Шумные постувулярные согласные по месту образования,custom,,Отсутствуют,,,
A-18,Дополнительные артикуляционные противопоставления шумных согласных,listed,A-18-1,Отсутствуют,,,
A-19,Инвентарь сонорных согласных по способу артикуляции,listed,A-19-6,"Назальные, плавные, вибранты и глайды","Назальные определяются как смычные чистые носовые, плавные - как щелевые боковые. Глайды /w/ и /y/ определяются как щелевые срединные однофокусные согласные.",,
A-20,Инвентарь сонорных согласных по месту образования,listed,A-20-17,"Лабиальные, переднеязычные, среднеязычные и заднеязычные",Различаются нецеребральные и церебральные назальные и вибранты.,,
A-21,Дополнительные противопоставления сонорных согласных,listed,A-21-1,Отсутствуют,,,
A-220,Инвентарь фрикативных согласных по месту образования,custom,,"Лабиальные, переднеязычные, среднеязычные и увулярные",Переднеязычные фрикативные подразделяются на нецеребральные и церебральные. Классификация отражает таблицу консонантизма в статье.,,
B-1,Тип ударения,not_stated,,,,,
B-2,Вид ударения,not_stated,,,,,
B-3,Носитель ударения,not_stated,,,,,
B-4,Фиксированность ударения,not_stated,,,,,
B-5,Носитель фиксированного ударения в слове,not_applicable,,,,,
B-6,Количество уровней тонов,not_stated,,,,,
B-7,Контурные признаки тона,not_applicable,,,,,
B-8,Носитель тона,not_applicable,,,,,
B-9,Характер долготы,explicit_gap,,,Фонологическая значимость долготы гласных неясна. ,,
B-10,Область гармонического уподобления гласных,not_stated,,,,,
B-11,Признак гармонического уподобления гласных,not_applicable,,,,,
B-12,Уподобляющий элемент при гармоническом уподоблении гласных,not_applicable,,,,,
B-13,Прочие супрасегментные явления,not_stated,,,,,
B-14,Типы фонации,not_stated,,,,,
C-1,Начальный согласный в слоге,not_stated,,,,,
C-2,Конечный согласный в слоге,listed,C-2-5,Есть закрытые и открытые слоги,,,
D-1,Ограничения на фонемную структуру сегментных морфем в начальной позиции,not_stated,,,,,
D-2,Ограничения на фонемную структуру сегментных морфем в конечной позиции,not_stated,,,,,
D-3,Особенности слогового состава слова,not_stated,,,,,
D-4,Различия между знаменательными и служебными словами,not_stated,,,,,
D-5,Различия между исконными и заимствованными словами,listed,D-5-2,Различия в фонетическом составе,,,
D-6,Различия между корневыми и аффиксальными морфемами,not_stated,,,,,
D-7,Функциональный тип чередований,explicit_gap,,,,,
D-8,Вид чередований,not_applicable,,,,,
E-1,Тип языка по способу соединения морфем в слове,listed,E-1-3,Флективный,,,
E-2,Признаки флективного строя,custom,,Кумулятивность флексий,,,
E-3,Признаки агглютинативного строя,not_stated,,,,,
E-4,Тип языка по степени спаянности морфем,listed,E-4-6,Синтетический с элементами аналитизма,,,
F-1,Количество согласовательных классов,listed,F-1-2,Два,Различаются мужской и женский род.,,
F-2,Морфологические способы выражения согласовательных классов,custom,,Флексии в имени и глаголе,,,
F-3,Синтаксические способы выражения согласовательных классов,listed,F-3-12,В прилагательном и глаголе,,,
F-4,Другие способы выражения согласовательных классов,not_stated,,,,,
F-5,Атрибутивное согласование по роду,listed,F-5-1,Только в единственном числе,Прилагательное предположительно не имеет категории числа.,,
F-6,Согласование количественных числительных в роде,listed,F-6-1,Отсутствует,,,
F-7,Классифицирующие категории существительных,listed,F-7-2,Личность/неличность,,,
F-8,Противопоставление по личности/неличности,listed,F-8-4,Лексическое и морфологическое,Термины родства принимают посессивные энклитики.,,
F-9,Способ выражения одушевленности/неодушевленности,not_stated,,,,,
G-1,Категория числа у существительных,listed,G-1-1,Единственное и множественное,,,
G-2,Маркирование единственного числа существительных,listed,G-2-2,Немаркированное,,,
G-3,Формы вежливости в местоимениях и глаголах,not_stated,,,,,
G-4,Согласование по числу,listed,G-4-2,Предикативное,,,
G-5,Форма числа существительного в сочетании с числительными,listed,G-5-3,Единственное и множественное,Число морфологически выражается в существительном в форме косвенного падежа.,,
G-6,Система счисления,listed,G-6-6,Двадцатеричная,,,
G-7,"Неопределенный артикль и числительное «один»",not_applicable,,,,,
H-1,Количество падежей у имени существительного,listed,H-1-1,Один-два,,,
H-2,Маркирование субъекта и объекта,custom,,"Падежные флексии, субъектная и объектная форма личных местоимений и глагольное согласование",,,
H-3,Падежное оформление именного сказуемого,not_stated,,,,,
H-4,Падежное оформление посессивного отношения в именной группе,listed,H-4-1,Генитив,Генитив присутствует в парадигме личных и указательных местоимений.,,
H-5,Другие способы оформления посессивного отношения,custom,,Поссесивные энклитики и послелоги, ,,
H-6,Способ выражения пространственных отношений,explicit_gap,,,Система средств пространственной ориентации зафиксирована фрагментарно. По сложности она предположительно схожа с системами других нуристанских языков.,,
H-7,Маркирование в посессивной конструкции,custom,,"Маркирование есть, требует уточнения",Генитив в падежной парадигме имени отсутствует. Посессивное значение маркируется послелогом. ,,
H-8,Падежное оформление одушевленных и неодушевленных имен существительных,listed,H-8-1,Нет различий,,,
H-9,Наличие вторичных падежей,listed,H-9-2,Отсутствуют,,,
I-1,Способ выражения залоговых форм в глаголе,listed,I-1-4,Аффиксы,Залог (каузатив/транзитив) выражается образуется с помощью суффикса.,,
I-2,Возможность наложения нескольких залоговых форм,not_stated,,,,,
I-3,Двойные залоговые формы,not_stated,,,,,
I-4,Совпадение залоговых форм,not_stated,,,,,
I-5,Грамматические формы времени,listed,I-5-1&I-5-2&I-5-3&I-5-5,Прошедшее&Настоящее&Будущее&Непрошедшее (настоящее-будущее),,,
I-6,Выражение вида и времени,listed,I-6-2,Синкретическое,,,
I-7,Способ выражения временных категорий,custom,,"Тип основы, флексии и вспомогательный глагол + причастие",,,
I-8,Синкретическое выражение нескольких глагольных значений,listed,I-8-19,"Лицо, число, род, время, вид и модальность (наклонение)",Род выражается в формах претерита.,,
I-9,Маркирование лица в глаголе в настоящем времени,listed,I-9-3,В единственном и множественном числе,,,
I-10,Маркер переходности,listed,I-10-8,Аффикс и особый тип согласования,,,
J-1,Наличие местоименных слов,listed,J-1-11,Местоимения-существительные и местоимения-прилагательные,,,
J-2,Способы выражения дейктических категорий,custom,,Указательные и неопределенные местоимения,,,
J-3,"Служебные части речи, выражающие пространственную ориентацию действия",listed,J-3-9,Предлоги и послелоги,,,
J-4,"Знаменательные части речи, выражающие пространственную ориентацию действия",listed,J-4-4,Местоимения,,,
J-5,Морфологическое выражение определенности/неопределенности имени,not_stated,,,,,
J-6,"Части речи, выражающие определенность/неопределенность имени",not_stated,,,,,
J-7,Способы выражения форм вежливости,not_stated,,,,,
J-8,Способы выражения отрицания,listed,J-8-1,Отрицательные аффиксы,,,
J-9,Позиция показателя отрицания,listed,J-9-3,Препозиция,,,
K-1,Склонение личных местоимений,listed,K-1-3,Собственный тип склонения,,,
K-2,Типы артиклей,listed,K-2-1,Артикли отсутствуют,,,
K-3,Расположение артикля,not_applicable,,,,,
K-4,Постановка артикля в именной группе,not_applicable,,,,,
K-5,"Грамматические категории, выражаемые артиклем",not_applicable,,,,,
K-6,Количество типов спряжения глаголов,not_stated,,,,,
K-7,Типы глагольного согласования,listed,K-7-3,Субъектное и объектное,,,
K-8,"Согласовательные категории, выражаемые причастием",listed,K-8-4,Род,,,
K-9,"Время, выражаемое причастием",listed,K-9-6,Настоящее и прошедшее,,,
K-10,"Грамматические категории, выражаемые наречием",explicit_gap,,,О наречиях достаточных сведений нет.,,
K-11,"Согласовательные категории, выражаемые прилагательным",listed,K-11-5,Род,,,
K-13,Возможность кумулятивного выражения нескольких категорий в прилагательном,listed,K-13-1,Отсутствует,,,
K-14,Атрибутивное согласование прилагательных,listed,K-14-1,Всегда присутствует,Есть изменяемые и неизменяемые прилагательные.,,
K-15,Типы атрибутивного согласования,listed,K-15-4,По роду,,,
K-16,"Изменяемые грамматические категории, выражаемые существительным",custom,,Число и падеж,,,
K-17,Кумулятивное выражение нескольких категорий в существительном,custom,,"Рода, числа и падежа",Число различается в косвенном падеже. ,,
K-18,Средства словоизменения,custom,,Аффиксы и флексии ,,,
K-19,Модель словоформы,listed,K-19-4,Преимущественно или только суффиксальная,,,
L-1,Способы словообразования,custom,,Основосложение и аффиксация,,,
L-2,"Аффиксы, участвующие в словообразовании",listed,L-2-3,Префиксы и суффиксы,,,
L-3,Отношения между соединяемыми основами при сложении основ,not_stated,,,,,
M-1,Стратегия кодирования глагольных актантов,listed,M-1-10,Номинативная и эргативная,,,
M-2,Фиксированность порядка слов,not_stated,,,,,
M-3,Основной порядок слов в предложении,listed,M-3-2,SOV,,,
M-4,Порядок определения и определяемого,listed,M-4-1,Определение предшествует определяемому,,,
M-5,Опущение местоименного подлежащего в неэллиптических предложениях,not_stated,,,,,
N-1,Линейный порядок компонентов в сложном предложении,explicit_gap,,,Сложное предложение не изучено.,,
N-2,Особенности подчиненного компонента в сложном предложении,not_applicable,,,,,
N-3,Оформление сказуемого в придаточном предложении,not_applicable,,,,,
N-4,Тип построения сложного предложения,not_applicable,,,,,
N-5,Тип связи между элементами сложного предложения,explicit_gap,,,О союзах достаточных сведений нет.,,
_aux,,not_applicable,,,А.К.Зотова/О.И.Романова,,
