feature_id,feature_name_ru,value_type,value_id,value_ru,comment_ru,comment_en,page_numbers
A-1,Количество степеней подъема,listed,A-1-3,Четыре,,,
A-2,Подъемы гласных,listed,A-2-5,"Верхний, верхне-средний, нижне-средний и нижний",,,
A-210,Противопоставление по открытости/закрытости в подъемах гласных,not_stated,,,,,
A-3,Ряды гласных,not_stated,,,Гласные по признаку ряда не интерпретируются.,,
A-4,Фонологические ступени долготы,listed,A-4-1,Фонологические ступени долготы отсутствуют,"Фонологическийй статус долготы, в качестве фонеморазличительного признака, не интерпретируется.",,
A-5,Противопоставление гласных по лабиализации,listed,A-5-1,Противопоставление гласных по лабиализации отсутствует,,,
A-6,Противопоставление гласных по назализации,listed,A-6-1,Противопоставление гласных по назализации отсутствует,,,
A-7,Противопоставление гласных по фарингализации,not_stated,,,,,
A-8,Противопоставление гласных по продвинутости корня языка,not_stated,,,,,
A-9,Наличие дифтонгов и трифтонгов,listed,A-9-1,Дифтонги и трифтонги отсутствуют,,,
A-10,Типы дифтонгов,not_applicable,,,,,
A-11,Инвентарь шумных согласных по ларингальным признакам,listed,A-11-1,Противопоставление по звонкости/глухости,,,
A-12,Типы шумных согласных по способу артикуляции,custom,,"Смычные: чистые (неносовые и носовые) и аффрикаты, щелевые: срединные (одно- и даухфокусные) и боковые",,,
A-13,Инвентарь шумных согласных по месту образования,listed,A-13-2,"Лабиальные, переднеязычные, среднеязычные, заднеязычные и постувулярные",,,
A-14,Типы шумных губных согласных по месту образования,listed,A-14-2,Губно-губные и губно-зубные,,,
A-15,Шумные переднеязычные согласные по месту образования,not_stated,,,Данные приводятся в символах международной иранистической транскрипции.,,
A-16,Типы шумных велярных и увулярных согласных по месту образования,listed,A-16-5,Велярные и увулярные,,,
A-17,Типы шумных ларингальных согласных по месту образования,listed,A-17-1,Только фарингальные,В составе фарингальных различаются верхне- и нижнефарингальные.,,
A-18,Дополнительные артикуляционные противопоставления шумных согласных,listed,A-18-2,По лабиализации,,,
A-19,Инвентарь сонорных согласных по способу артикуляции,listed,A-19-6,"Назальные, плавные, вибранты и глайды","Назальные интерпретируются как смычные, плавные - как щелевые боковые, глайды /w/ и /y/ - как однофокусные срединные щелевые.",,
A-20,Инвентарь сонорных согласных по месту образования,listed,A-20-7,Лабиальные и переднеязычные,,,
A-21,Дополнительные противопоставления сонорных согласных,listed,A-21-1,Отсутствуют,,,
A-220,Инвентарь фрикативных согласных по месту образования,not_stated,,,,,
B-1,Тип ударения,listed,B-1-3,Нефонологическое,,,
B-2,Вид ударения,listed,B-2-1,Динамическое,,,
B-3,Носитель ударения,listed,B-3-1,Слог,,,
B-4,Фиксированность ударения,listed,B-4-3,Разноместно фиксированное,,,
B-5,Носитель фиксированного ударения в слове,custom,,"Корневой гласный основы, пенультима, антепенультима или третий от конца слог словоформы",,,
B-6,Количество уровней тонов,not_stated,,,,,
B-7,Контурные признаки тона,not_stated,,,,,
B-8,Носитель тона,not_stated,,,,,
B-9,Характер долготы,listed,B-9-2,Нефонологическая,Других данных нет.,,
B-10,Область гармонического уподобления гласных,not_stated,,,,,
B-11,Признак гармонического уподобления гласных,not_stated,,,,,
B-12,Уподобляющий элемент при гармоническом уподоблении гласных,not_stated,,,,,
B-13,Прочие супрасегментные явления,not_stated,,,,,
B-14,Типы фонации,not_stated,,,,,
C-1,Начальный согласный в слоге,listed,C-1-5,Есть прикрытые и неприкрытые слоги,,,
C-2,Конечный согласный в слоге,listed,C-2-5,Есть закрытые и открытые слоги,,,
D-1,Ограничения на фонемную структуру сегментных морфем в начальной позиции,listed,D-1-1,Отсутствуют,,,
D-2,Ограничения на фонемную структуру сегментных морфем в конечной позиции,custom,,Запрет на стечения согласных в заударной позиции,,,
D-3,Особенности слогового состава слова,not_stated,,,,,
D-4,Различия между знаменательными и служебными словами,listed,D-4-3,Акцентные различия,,,
D-5,Различия между исконными и заимствованными словами,listed,D-5-8,Различия в фонетическом составе и акцентные различия,,,
D-6,Различия между корневыми и аффиксальными морфемами,listed,D-6-3,Акцентные различия,,,
D-7,Функциональный тип чередований,listed,D-7-4,Сопутствующие и смыслоразличительные,,,
D-8,Вид чередований,listed,D-8-6,Вокалические и консонантные,,,
E-1,Тип языка по способу соединения морфем в слове,custom,,Язык смешанного типа,,,
E-2,Признаки флективного строя,listed,E-2-2,Кумулятивность аффиксов,,,
E-3,Признаки агглютинативного строя,listed,E-3-4,Постоянство морфемного облика,,,
E-4,Тип языка по степени спаянности морфем,custom,,Язык смешанного типа,,,
F-1,Количество согласовательных классов,listed,F-1-1,Согласовательные классы отсутствуют,,,
F-2,Морфологические способы выражения согласовательных классов,not_applicable,,,,,
F-3,Синтаксические способы выражения согласовательных классов,not_applicable,,,,,
F-4,Другие способы выражения согласовательных классов,custom,,Лексические и слова-детерминативы,,,
F-5,Атрибутивное согласование по роду,not_stated,,,,,
F-6,Согласование количественных числительных в роде,not_stated,,,,,
F-7,Классифицирующие категории существительных,listed,F-7-1,Отсутствуют,,,
F-8,Противопоставление по личности/неличности,listed,F-8-3,Синтаксическое,,,
F-9,Способ выражения одушевленности/неодушевленности,listed,F-9-4,Лексический и синтаксический,,,
G-1,Категория числа у существительных,listed,G-1-1,Единственное и множественное,,,
G-2,Маркирование единственного числа существительных,listed,G-2-2,Немаркированное,,,
G-3,Формы вежливости в местоимениях и глаголах,not_stated,,,,,
G-4,Согласование по числу,listed,G-4-4,Предикативное и атрибутивное,,,
G-5,Форма числа существительного в сочетании с числительными,listed,G-5-3,Единственное и множественное,,,
G-6,Система счисления,not_stated,,,,,
H-1,Количество падежей у имени существительного,listed,H-1-1,Один-два,,,
H-2,Маркирование субъекта и объекта,listed,H-2-11,"Объектная форма местоимений, служебные слова, падежные аффиксы и глагольное согласование",,,
H-3,Падежное оформление именного сказуемого,listed,H-3-4,Номинатив,,,
H-4,Падежное оформление посессивного отношения в именной группе,listed,H-4-5,Косвенный,,,
H-5,Другие способы оформления посессивного отношения,listed,H-5-14,"Соположение, притяжательное местоимение, притяжательные прилагательные и притяжательные аффиксы",,,
H-6,Способ выражения пространственных отношений,listed,H-6-21,"Именные аффиксы, предлоги и послелоги",,,
H-7,Маркирование в посессивной конструкции,not_stated,,,,,
H-8,Падежное оформление одушевленных и неодушевленных имен существительных,listed,H-8-2,Есть различия,,,
H-9,Наличие вторичных падежей,not_stated,,,,,
I-1,Способ выражения залоговых форм в глаголе,custom,,"Вспомогательный глагол + причастие, аналитические обороты с пассивным значением",,,
I-2,Возможность наложения нескольких залоговых форм,not_stated,,,,,
I-3,Двойные залоговые формы,not_stated,,,,,
I-4,Совпадение залоговых форм,not_stated,,,,,
I-5,Грамматические формы времени,listed,I-5-1&I-5-5,Прошедшее&Непрошедшее (настоящее-будущее),,,
I-6,Выражение вида и времени,listed,I-6-2,Синкретическое,,,
I-7,Способ выражения временных категорий,custom,,"Тип основы, аффиксы (аугменты и суффиксы), флективные показатели лица и числа вспомогательные глаголы",,,
I-8,Синкретическое выражение нескольких глагольных значений,listed,I-8-17,"Лицо, число, время, вид и модальность (наклонение)",,,
I-9,Маркирование лица в глаголе в настоящем времени,listed,I-9-3,В единственном и множественном числе,,,
I-10,Маркер переходности,custom,,Особый тип согласование и изменение типа спряжения,,,
J-1,Наличие местоименных слов,listed,J-1-11,Местоимения-существительные и местоимения-прилагательные,,,
J-2,Способы выражения дейктических категорий,listed,J-2-17,"Указательные местоимения, послелоги и наречия",,,
J-3,"Служебные части речи, выражающие пространственную ориентацию действия",listed,J-3-9,Предлоги и послелоги,,,
J-4,"Знаменательные части речи, выражающие пространственную ориентацию действия",custom,,"Глаголы-модификаторы, местоимения и наречия",,,
J-5,Морфологическое выражение определенности/неопределенности имени,not_stated,,,,,
J-6,"Части речи, выражающие определенность/неопределенность имени",listed,J-6-21,"Артикли, местоимения и числительные",,,
J-7,Способы выражения форм вежливости,not_stated,,,,,
J-8,Способы выражения отрицания,listed,J-8-3,Отрицательные частицы,,,
J-9,Позиция показателя отрицания,listed,J-9-3,Препозиция,,,
K-1,Склонение личных местоимений,listed,K-1-3,Собственный тип склонения,,,
K-2,Типы артиклей,listed,K-2-4,Определенный и неопределенный,,,
K-3,Неопределенный артикль и числительное «один»,not_stated,,,,,
K-4,Расположение артикля,listed,K-4-1,Препозиция,,,
K-5,Постановка артикля в именной группе,not_stated,,,,,
K-6,"Грамматические категории, выражаемые артиклем",listed,K-6-2,Определенность,Других данных нет.,,
K-7,Количество типов спряжения глаголов,listed,K-7-1,Единый тип спряжения,,,
K-8,Типы глагольного согласования,listed,K-8-3,Субъектное и объектное,,,
K-9,"Согласовательные категории, выражаемые причастием",listed,K-9-2,Падеж,,,
K-10,"Время, выражаемое причастием",listed,K-10-8,Настоящее-будущее и прошедшее,,,
K-11,"Грамматические категории, выражаемые наречием",listed,K-11-2,Степени сравнения,,,
K-12,"Согласовательные категории, выражаемые прилагательным",listed,K-12-1,Отсутствуют,,,
K-13,Возможность кумулятивного выражения нескольких категорий в прилагательном,not_stated,,,,,
K-14,Атрибутивное согласование прилагательных,not_stated,,,,,
K-15,Типы атрибутивного согласования,not_stated,,,,,
K-16,"Изменяемые грамматические категории, выражаемые существительным",listed,K-16-7,Число и падеж,,,
K-17,Кумулятивное выражение нескольких категорий в существительном,listed,K-17-6,Числа и падежа,,,
K-18,Средства словоизменения,listed,K-18-5,Внутренняя флексия и аффиксы,,,
K-19,Модель словоформы,listed,K-19-4,Преимущественно или только суффиксальная,,,
L-1,Способы словообразования,listed,L-1-12,Аффиксация и словосложение,,,
L-2,"Аффиксы, участвующие в словообразовании",listed,L-2-3,Префиксы и суффиксы,,,
L-3,Отношения между соединяемыми основами при сложении основ,not_stated,,,,,
M-1,Стратегия кодирования глагольных актантов,listed,M-1-7,Аккузативная с элементами эргативной,,,
M-2,Фиксированность порядка слов,not_stated,,,,,
M-3,Основной порядок слов в предложении,listed,M-3-2,SOV,,,
M-4,Порядок определения и определяемого,listed,M-4-1,Определение предшествует определяемому,,,
M-5,Опущение местоименного подлежащего в неэллиптических предложениях,not_stated,,,,,
N-1,Линейный порядок компонентов в сложном предложении,listed,N-1-3,Не фиксирован,,,
N-2,Особенности подчиненного компонента в сложном предложении,not_stated,,,,,
N-3,Оформление сказуемого в придаточном предложении,listed,N-3-3,Финитные и нефинитные формы,,,
N-4,Тип построения сложного предложения,listed,N-4-4,Сочинение и подчинение,,,
N-5,Тип связи между элементами сложного предложения,listed,N-5-3,Союзная и бессоюзная,,,
_aux,,not_applicable,,,А.К.Зотова,,
